Tweet URL,Created At,Text,Tweet ID,Likes,Retweets,Replies,Hashtags,Mentions,URLs,tag,sentiment
https://x.com/VA_TRAINING/status/1450027108005187586,2021-10-18T09:12:57.000Z,"Have you taken a look at our online courses before?
You could complete a course from the comfort of your own home!

Take a look...https://bit.ly/3BLKBdq#training#onlinecourses#lantra#cityandguilds#ukrs#trainingcourses",Unknown,Unknown,Unknown,Unknown,"#training, #onlinecourses, #lantra, #cityandguilds, #ukrs, #trainingcourses",@VA_TRAINING,https://t.co/SOPP1beY4w,hashtag_2021,positive
https://x.com/VA_TRAINING/status/1460549542831878145,2021-11-16T10:05:21.000Z,"Hello Autumn...
Are you due refresher training this autumn or winter?

We have available spaces on some of our upcoming courses, check them out on our course calendarhttps://va-training.co.uk/course-calendar/…Or give us a call 01609 882408.#training#lantra#cityandguilds#autumn",Unknown,Unknown,Unknown,Unknown,"#training, #lantra, #cityandguilds, #autumn",@VA_TRAINING,https://t.co/zhb7JXqIwh,hashtag_2021,neutral
https://x.com/ableskills/status/1387312174658428931,2021-04-28T07:46:12.000Z,Watch here as some of our students on their Electrician course get their hands dirty! To find out more about our Electrician courses click here:https://ableskills.co.uk/electrician-training-courses/…#cityandguilds#AbleSkills#learning,Unknown,Unknown,Unknown,Unknown,"#cityandguilds, #AbleSkills, #learning",@ableskills,https://t.co/n365NZ2SCk,hashtag_2021,neutral
https://x.com/WeAreESCG/status/1372465306464051200,2021-03-18T08:30:02.000Z,"Lewes beauty students made history recently with the first ever online beauty assessments!! They battled difficult challenges with noisy siblings, wifi issues and homemade products to deliver amazing treatments#proudbeautytutor#ESCLewes#cityandguilds",Unknown,Unknown,Unknown,Unknown,"#proudbeautytutor, #ESCLewes, #cityandguilds",@WeAreESCG,,hashtag_2021,positive
https://x.com/jgrgroup/status/1375420111293669376,2021-03-26T12:11:23.000Z,"Are you looking for the skills to get a job or progress?
We can offer fully funded* (no cost)#EmployabilitySkills quals including Awards, Certificates and Diplomas with#CityandGuildsthat can boost your chances of success!http://jgr.co.uk/employability-skills/…*Funded by Welsh Government",Unknown,Unknown,Unknown,Unknown,"#Employability, #CityandGuilds",@jgrgroup,https://t.co/crUhr2h4cD,hashtag_2021,positive
https://x.com/forestrylandba1/status/1365328054151770112,2021-02-26T15:49:09.000Z,"We have exciting news! 
We've been working withhttp://electricthought.co.ukon our rebrand, and our NEW website is now LIVE and ready for you to view athttp://fltraining.co.uk#chainsaws#agriculture#courses#pesticides#machinery#training#lincs#notts#lantra#cityandguilds",Unknown,Unknown,Unknown,Unknown,"#chainsaws, #agriculture, #courses, #pesticides, #machinery, #training, #lincs, #notts, #lantra, #cityandguilds",@forestrylandba1,"https://t.co/NQS10uz7SY, https://t.co/WMDiXbDa8V",hashtag_2021,positive
https://x.com/bespokebeheard/status/1402619836841275403,2021-06-09T13:33:23.000Z,"City and Guilds L2 Certificate in cycle mechanics: frame swap- complete strip down and rebuild with a test ride at the end; excellent job Christos! 
.
.
.@cityandguilds#bicyclemechanics#bikemaintenance#cycletechnician#bicycleservice#cityandguilds#BESPOKEbeHEARD",Unknown,Unknown,Unknown,Unknown,"#bicyclemechanics, #bikemaintenance, #cycletechnician, #bicycleservice, #cityandguilds, #BESPOKEbeHEARD","@bespokebeheard, @cityandguilds",,hashtag_2021,positive
