Tweet URL,Created At,Text,Tweet ID,Likes,Retweets,Replies,Hashtags,Mentions,URLs,tag,sentiment
https://x.com/CambriaCeltica/status/1399345780566237184,2021-05-31T12:43:27.000Z,Happy to say after 12 months study I achieved#cityandguildsLevel 3#Diplomain Customer Service through @colegllandrillo. It has been good to formalise what I do in work into a vocational award & qualification#LlandrilloCollege#CustomerService#Library#Diploma#Qualification,Unknown,Unknown,Unknown,Unknown,"#cityandguilds, #Diploma, #LlandrilloCollege, #CustomerService, #Library, #Diploma, #Qualification",@CambriaCeltica,,hashtag_2021,positive
https://x.com/DIFEedu/status/1405864492614000640,2021-06-18T12:26:29.000Z,"DIFE has 55 full-time courses to choose from, all offer excellent progression pathways or employment opportunities. Apply today & earn your#QQI,#ITEC,#CIBTAC,#NVQ,#CityandGuildsor professional trade qualification with us:https://dife.ie#YourCollegeYourFuture",Unknown,Unknown,Unknown,Unknown,"#QQI, #ITEC, #CIBTAC, #NVQ, #CityandGuilds, #YourCollegeYourFuture",@DIFEedu,https://t.co/vK5rSZl7NM,hashtag_2021,positive
https://x.com/Hills_Ford/status/1448205378676723715,2021-10-13T08:34:03.000Z,"Congratulations to Charley Sewell from all his colleagues@Hills_Fordon achieving his#CityAndGuildsLevel 3 Certificate in Principles of Sales.

A great member of the team#WorcestershireHour!#InvestmentInPeople#PeopleDevelopment",Unknown,Unknown,Unknown,Unknown,"#CityAndGuilds, #WorcestershireHour, #InvestmentInPeople, #PeopleDevelopment","@Hills_Ford, @Hills_Ford",,hashtag_2021,positive
https://x.com/APAIRLtd/status/1430078503177891840,2021-08-24T08:04:19.000Z,"Congrats to Telesales Exec, Fin who passed his#CityandGuilds#Refrigeranthandlingcourse.
As an approved training centre we can help you achieve:LEVEL 3 AWARD IN BASIC MOBILE A/C SYSTEMS (7543-01)LEVEL 3 DIAGNOSIS & REPAIR OF MOBILE A/C SYSTEMS (7543-02)01453 891320",Unknown,Unknown,Unknown,Unknown,"#CityandGuilds, #Refrigeranthandling",@APAIRLtd,,hashtag_2021,positive
https://x.com/SBC_Training/status/1448674443870539778,2021-10-14T15:37:57.000Z,Last chance to book for our 1-day#18thEditionCourse NEXT WEDNESDAY!Do you still need to update to the latest amendment? Call 01743 454810 or email courses@sbc-training.co.uk to book your place.#electricians#wiring#1day#cityandguilds#course#shrewsbury#shropshire,Unknown,Unknown,Unknown,Unknown,"#18thEdition, #electricians, #wiring, #1day, #cityandguilds, #course, #shrewsbury, #shropshire",@SBC_Training,,hashtag_2021,neutral
https://x.com/APAIRLtd/status/1445668846761697291,2021-10-06T08:34:46.000Z,"Why enlist on our#CityandGuilds#Fgastraining courses? 
Because we get#feedbacklike this!For more infoDave on 01453 891320#technicaltraining#ACservice#repair#diagnosis#engineer#mobileaircon#Agtwitter#automotive#machinery#aftermarket#refrigerant#R134a",Unknown,Unknown,Unknown,Unknown,"#CityandGuilds, #Fgas, #feedback, #technicaltraining, #ACservice, #repair, #diagnosis, #engineer, #mobileaircon, #Agtwitter, #automotive, #machinery, #aftermarket, #refrigerant, #R134a",@APAIRLtd,,hashtag_2021,positive
https://x.com/APAIRLtd/status/1441414802824384512,2021-09-24T14:50:43.000Z,"No wonder she’s smiling! 
Lauren Savage@Landbased_Eng2021#TechnicianoftheYearrunner-up from@chandlersfehas completed her prize#CityandGuildsA/C training with us and passedWell done – you're an industry inspiration@AGCOcorp@Fendt_UKIreland@MF_EAME@ValtraGlobal",Unknown,Unknown,Unknown,Unknown,"#TechnicianoftheYear, #CityandGuilds","@APAIRLtd, @Landbased_Eng, @chandlersfe, @AGCOcorp, @Fendt_UKIreland, @MF_EAME, @ValtraGlobal",,hashtag_2021,positive
https://x.com/APAIRLtd/status/1441424630560878603,2021-09-24T15:29:46.000Z,"Sisters doing it for themselves and their industry! 
Laura & Lauren are now@Landbased_Eng#TechnicianoftheYearwinners#CityandGuildsLevel 3 Awards 7543-01 & 7543-02 qualified
& with the newAC tools we gave them, will be unstoppable!#agtwitter#AgEngineer",Unknown,Unknown,Unknown,Unknown,"#TechnicianoftheYear, #CityandGuilds, #agtwitter, #AgEngineer","@APAIRLtd, @Landbased_Eng",,hashtag_2021,positive
https://x.com/APAIRLtd/status/1420283294193696768,2021-07-28T07:21:39.000Z,"Who else is looking forward to the@TheCVShownext month?
We can't wait to see you all at the#NEC, but in the meantime check out the#CommercialVehicleShowpreview in the Jul/Aug issue of#TransportOperator.#agrilite302#fgas#cityandguilds#airconparts#lcv#truck#van#fleet",Unknown,Unknown,Unknown,Unknown,"#NEC, #CommercialVehicleShow, #TransportOperator, #agrilite302, #fgas, #cityandguilds, #airconparts, #lcv, #truck, #van, #fleet","@APAIRLtd, @TheCVShow",,hashtag_2021,positive
https://x.com/LCinNIreland/status/1396771858784133121,2021-05-24T10:15:36.000Z,"A huge CONGRATS to our CAN DO stars from@OrchardvilleNIwho have achieved their#cityandguildsAccreditation Awards. Our young people worked with top artist Karen Daye Hutchinson, completing a project based on their lockdown life. A huge thanks to the staff at Orchardville.",Unknown,Unknown,Unknown,Unknown,#cityandguilds,"@LCinNIreland, @OrchardvilleNI",,hashtag_2021,positive
https://x.com/focustrainingsw/status/1454338792509349890,2021-10-30T06:46:03.000Z,"There are a few spaces left on these courses,
don't miss out book now!
Enquiries@thefocustraininggroup.com 01392 829100#Electricalcourses#skillsforlife#training#Exeter#18thedition#cityandguilds",Unknown,Unknown,Unknown,Unknown,"#Electricalcourses, #skillsforlife, #training, #Exeter, #18thedition, #cityandguilds",@focustrainingsw,,hashtag_2021,positive
https://x.com/focustrainingsw/status/1453015576608133131,2021-10-26T15:08:03.000Z,"Upcoming courses in our Exeter Centre 
Don't miss out! 
For further information or to book your space
Call  01392 829100#electricaltraining#cityandguilds#training#Exeter",Unknown,Unknown,Unknown,Unknown,"#electricaltraining, #cityandguilds, #training, #Exeter",@focustrainingsw,,hashtag_2021,positive
https://x.com/VA_TRAINING/status/1423157566574534661,2021-08-05T05:42:59.000Z,It isn’t all outside stuff at this time in the morning!#Farm24updating the website to enable us to provide training to the hard working farmers to keep them safe and up to date!#training#lantra#cityandguilds,Unknown,Unknown,Unknown,Unknown,"#Farm24, #training, #lantra, #cityandguilds",@VA_TRAINING,,hashtag_2021,positive
https://x.com/GTIGALWAY/status/1446510272638853147,2021-10-08T16:18:18.000Z,Well done to the GTI Year Two Hairdressing students as they did a fantastic job in completing City & Guilds examinations this week. These practical exams form a key part of their course requirements. Well done to all students involved.#GTIGalway#GRETB#Concept#CityandGuilds,Unknown,Unknown,Unknown,Unknown,"#GTIGalway, #GRETB, #Concept, #CityandGuilds",@GTIGALWAY,,hashtag_2021,positive
https://x.com/AlphaHealthSafe/status/1418473511677464578,2021-07-23T07:30:13.000Z,"***The new 6160 Confined Space Training Courses are now bookable***

Go to our website via this link to view the new courses:https://bit.ly/3ia1o2#ConfinedSpaceTraining#cityandguilds",Unknown,Unknown,Unknown,Unknown,"#ConfinedSpaceTraining, #cityandguilds",@AlphaHealthSafe,https://t.co/Qrit2hFeZI,hashtag_2021,neutral
https://x.com/focustrainingsw/status/1418920915384086533,2021-07-24T13:08:03.000Z,"Don't miss out as we only have 2 available spaces left
Contact Kayleigh.m@tftg.org 01209 311001#cityandguilds#Electricvehiclecharging#training#cornwalllife",Unknown,Unknown,Unknown,Unknown,"#cityandguilds, #Electricvehiclecharging, #training, #cornwalllife",@focustrainingsw,,hashtag_2021,neutral
https://x.com/Construction_HA/status/1462884922293641220,2021-11-22T20:45:19.000Z,#Confinedspacetraining low medium and high risk now fully funded  for employers and individuals.#cityandguildsaccredited across Wales,Unknown,Unknown,Unknown,Unknown,"#Confinedspace, #cityandguilds",@Construction_HA,,hashtag_2021,positive
https://x.com/AFCPorth/status/1406159758588010497,2021-06-19T07:59:46.000Z,"Many thanks ,latest Sponsor@Deanomorris08for all decorating,property maintenance needs#CityandGuildsMuch appreciated by us all at the club. 
Please support local business,as they suporrt us. Diolch#BlackDragons",Unknown,Unknown,Unknown,Unknown,"#CityandGuilds, #BlackDragons","@AFCPorth, @Deanomorris08",,hashtag_2021,positive
https://x.com/APAIRLtd/status/1448972460444028930,2021-10-15T11:22:09.000Z,"Wow, what a beauty!
Thanks to@chandlersfefor letting us use the awesome@MF_EAME8S to shoot some material promoting our F-gas training courses this morning.#fgas#cityandguilds#masseyferguson#MF8S#agricold302#oksys#aircon#r134a#agriculturalmachinery#AgTwitter",Unknown,Unknown,Unknown,Unknown,"#fgas, #cityandguilds, #masseyferguson, #MF8S, #agricold302, #oksys, #aircon, #r134a, #agriculturalmachinery, #AgTwitter","@APAIRLtd, @chandlersfe, @MF_EAME",,hashtag_2021,positive
https://x.com/BangorBioZoo/status/1424682510059982851,2021-08-09T10:42:34.000Z,"Whatever happens tomorrow, we can help! 0800 0851818#clearing2021#alevels2021#BTEC#CityandGuilds#Universityplaces#Biologyand#Zoologyhttps://bangor.ac.uk/bangortv/location…#UCAS",Unknown,Unknown,Unknown,Unknown,"#clearing2021, #alevels2021, #BTEC, #CityandGuilds, #University, #Biology, #Zoology, #UCAS",@BangorBioZoo,https://t.co/xNQprEWrhc,hashtag_2021,neutral
https://x.com/InfinityEnergy1/status/1474439936040480784,2021-12-24T18:00:49.000Z,Best wishes for a happy holiday season and a joyous new year.#holidays#retrofitcoordinator#infinityenergyorganisation#cityandguilds#ECO#pas2035#eco3#nvq#epc#dea#retrofitassessor#retrofit,Unknown,Unknown,Unknown,Unknown,"#holidays, #retrofitcoordinator, #infinityenergyorganisation, #cityandguilds, #ECO, #pas2035, #eco3, #nvq, #epc, #dea, #retrofitassessor, #retrofit",@InfinityEnergy1,,hashtag_2021,positive
https://x.com/InfinityEnergy1/status/1476614295593103364,2021-12-30T18:00:56.000Z,Infinity Energy Organisation was created in 2012 out of a passion for energy saving and sustainable solutions.#retrofitcoordinator#infinityenergyorganisation#cityandguilds#ECO#pas2035#eco3#nvq#epc#dea#retrofitassessor,Unknown,Unknown,Unknown,Unknown,"#retrofitcoordinator, #infinityenergyorganisation, #cityandguilds, #ECO, #pas2035, #eco3, #nvq, #epc, #dea, #retrofitassessor",@InfinityEnergy1,,hashtag_2021,positive
https://x.com/InfinityEnergy1/status/1469208627126931459,2021-12-10T07:33:27.000Z,We are passionate about helping energy companies in achieving the targets that need to be met to make homes more energy efficient. Reach us today!#retrofitcoordinator#infinityenergyorganisation#cityandguilds#ECO#pas2035#eco3#nvq#epc#dea#retrofitassessor#retrofit,Unknown,Unknown,Unknown,Unknown,"#retrofitcoordinator, #infinityenergyorganisation, #cityandguilds, #ECO, #pas2035, #eco3, #nvq, #epc, #dea, #retrofitassessor, #retrofit",@InfinityEnergy1,,hashtag_2021,positive
https://x.com/ableskills/status/1415298717163397120,2021-07-14T13:14:43.000Z,"Our Electrical students are working hard as they get stuck into some more practical tasks on their City & Guilds Electrical Training Course.

Click here to read more about our Electrical Courses:https://ableskills.co.uk/electrician-training-courses/…#cityandguilds#electricianlife#ableskills#electricity",Unknown,Unknown,Unknown,Unknown,"#cityandguilds, #electricianlife, #ableskills, #electricity",@ableskills,https://t.co/n365NZ2SCk,hashtag_2021,positive
https://x.com/APAIRLtd/status/1414488661769523200,2021-07-12T07:35:51.000Z,The latest page-turner from@cvwmagazineis out today and you'll find us inside!#advert#airconparts#training#mobileaircon#CommercialVehicles#cityandguilds#CommercialVehicleShow#acservicemachines#airconstations#oksys#acparts#fgas,Unknown,Unknown,Unknown,Unknown,"#advert, #airconparts, #training, #mobileaircon, #CommercialVehicles, #cityandguilds, #CommercialVehicleShow, #acservicemachines, #airconstations, #oksys, #acparts, #fgas","@APAIRLtd, @cvwmagazine",,hashtag_2021,positive
https://x.com/reaxltd/status/1387366245893296131,2021-04-28T11:21:03.000Z,"Are you aware that the#CityandGuilds6150 confined space suite of courses are changing to the 6160 suite as of the 31st of August 2021?

For more information get in contact with our office at REAX - 01253767775 or info@reaxltd.com",Unknown,Unknown,Unknown,Unknown,#CityandGuilds,@reaxltd,,hashtag_2021,neutral
https://x.com/GBricklayers/status/1408361592064991238,2021-06-25T09:49:04.000Z,"GOB 29th Conference being held online discussing construction education, what changes are planned and the implementation of these changes, as well as providing subject specialist CPD for bricklayers#gob#lovebrick#citb#cityandguilds#abc#brickjackets#thesquare#forterra",Unknown,Unknown,Unknown,Unknown,"#gob, #lovebrick, #citb, #cityandguilds, #abc, #brickjackets, #thesquare, #forterra",@GBricklayers,,hashtag_2021,neutral
https://x.com/GalliganBeauty/status/1456208097576423424,2021-11-04T10:34:00.000Z,"Look number 2! 

Style and colour by Emilija#cityandguilds#galligancollege",Unknown,Unknown,Unknown,Unknown,"#cityandguilds, #galligancollege",@GalliganBeauty,,hashtag_2021,positive
https://x.com/ECS_Card/status/1434817396234244103,2021-09-06T09:54:59.000Z,"The Network Infrastructure Assistant ECS card has been updated to include City & Guilds qualification. 

Learn more herehttps://ecscard.org.uk/news/Network-Infrastructure-Assistant-ECS-card-updated-…#ECS#CityandGuilds#Network#Infrastructure",Unknown,Unknown,Unknown,Unknown,"#ECS, #CityandGuilds, #Network, #Infrastructure",@ECS_Card,https://t.co/0SRKlXykzn,hashtag_2021,neutral
https://x.com/CGServices/status/1466373440902946816,2021-12-02T11:47:26.000Z,Follow us - Be the first to be notified when new courses are set up & special offers are launched - choose us for your effective & approved training#gettrained#CCNSG#CITB#Safetypassport#CPCS#NVQ#Lantra#NPORS#ADR#NRSWA#Streetworks#Greencard#CityandGuilds#DVSA#IPAF,Unknown,Unknown,Unknown,Unknown,"#gettrained, #CCNSG, #CITB, #Safetypassport, #CPCS, #NVQ, #Lantra, #NPORS, #ADR, #NRSWA, #Streetworks, #Greencard, #CityandGuilds, #DVSA, #IPAF",@CGServices,,hashtag_2021,positive
https://x.com/APAIRLtd/status/1443539109323186179,2021-09-30T11:31:57.000Z,"With#LAMMA22still a way off we decided to squeeze in another#showbefore the year’s out. 
Come & see us at@Mechanexwhere we will be exhibiting alongside our#automotivedivision@APAuto4#aircon#acservicing#airconmachines#hvac#cityandguilds#fgas#R134a#R1234yf",Unknown,Unknown,Unknown,Unknown,"#LAMMA22, #show, #automotive, #aircon, #acservicing, #airconmachines, #hvac, #cityandguilds, #fgas, #R134a, #R1234yf","@APAIRLtd, @Mechanex, @APAuto4",,hashtag_2021,neutral
https://x.com/nonsocucinare/status/1419698280661913608,2021-07-26T16:37:01.000Z,Please could you share this post on Twitter or LinkedIn or tag anyone you know and help my son find an internship. Thank you.#supportedinternship#autism#carpentrycityandguilds#cityandguilds#LinkedIn,Unknown,Unknown,Unknown,Unknown,"#supportedinternship, #autism, #carpentrycityandguilds, #cityandguilds, #LinkedIn",@nonsocucinare,"https://t.co/MtfzznKElq, https://t.co/MtfzznKElq",hashtag_2021,positive
https://x.com/CGServices/status/1430073476086382594,2021-08-24T07:44:20.000Z,"For all of your Street Works training needs, we deliver full courses and reassessments for both Operators and Supervisors. To find out more please call 
0844 335 6433 or info@gettrained.co.uk#cityandguilds#CABWI#gettrained",Unknown,Unknown,Unknown,Unknown,"#cityandguilds, #CABWI, #gettrained",@CGServices,,hashtag_2021,neutral
https://x.com/BangorSENS/status/1424673265126158339,2021-08-09T10:05:50.000Z,"Whatever happens tomorrow, we can help! 0800 0851818#clearing2021#alevels2021#BTEC#CityandGuilds#Universityplaceshttps://bangor.ac.uk/bangortv/location…@BangorUni#UCAS",Unknown,Unknown,Unknown,Unknown,"#clearing2021, #alevels2021, #BTEC, #CityandGuilds, #University, #UCAS","Environmental & Natural Sciences @ Bangor Univ., @BangorSENS, @BangorUni",https://t.co/E5gzSvPeDH,hashtag_2021,neutral
https://x.com/croxtethgarden/status/1461389608755863556,2021-11-18T17:43:28.000Z,"A quiet afternoon at our horticulture course, so we raked these leaves to allow them to rot down. These will form an organic mulch to spread onto our beds in a future session.#croxteth#autumnleaves#horticulture#cityandguilds#freecourse#freeadultlearning#liverpool#l11",Unknown,Unknown,Unknown,Unknown,"#croxteth, #autumnleaves, #horticulture, #cityandguilds, #freecourse, #freeadultlearning, #liverpool, #l11",@croxtethgarden,,hashtag_2021,neutral
https://x.com/bbbiznetwork/status/1470895882958684163,2021-12-14T23:18:01.000Z,City & Guilds Diploma in Digital Marketing – Start your career with this globally recognized qualification!!! Contact Gregory Blackett (246) 249-7774 | info@bbbiznetwork.com#cityandguilds#diploma#digitalmarketing#careerdevelopment#professionaldevelopment,Unknown,Unknown,Unknown,Unknown,"#cityandguilds, #diploma, #digitalmarketing, #careerdevelopment, #professionaldevelopment",@bbbiznetwork,,hashtag_2021,positive
https://x.com/FEAlex24/status/1448912780007034885,2021-10-15T07:25:00.000Z,Getting ready for a group of advance L3 students in the workshop this morning.#FEeducation#EdTwitter#cityandguilds#education#lecture#FE,Unknown,Unknown,Unknown,Unknown,"#FEeducation, #EdTwitter, #cityandguilds, #education, #lecture, #FE",@FEAlex24,,hashtag_2021,neutral
https://x.com/turner_trees/status/1438797581627297794,2021-09-17T09:30:49.000Z,"MOOC certificates are welcome in the workplace, especially in the technology sector, there are many online partakers studying digital courses. I have 136 F. L. certificates and 33 O. L. badges; some certificates equal University credits.#KeithPottTurner#46Moocs#CityandGuilds",Unknown,Unknown,Unknown,Unknown,"#KeithPottTurner, #46Moocs, #CityandGuilds",@turner_trees,,hashtag_2021,positive
https://x.com/MyAdultSkills/status/1406904917118365700,2021-06-21T09:20:45.000Z,"Here at Myerscough we offer a range of Aboriculture and Chainsaw courses, from beginner to advanced!https://myerscough.ac.uk/courses/chainsaw/type/short-course/…#chainsaw#treeclimbing#arboriculture#treefelling#LANTRA#cityandguilds#savethetrees#ukwildlife#woodlandmanagement#lancashire#myerscough",Unknown,Unknown,Unknown,Unknown,"#chainsaw, #treeclimbing, #arboriculture, #treefelling, #LANTRA, #cityandguilds, #savethetrees, #ukwildlife, #woodlandmanagement, #lancashire, #myerscough",@MyAdultSkills,https://t.co/3xCPLg9quL,hashtag_2021,positive
https://x.com/ableskills/status/1407977763051651075,2021-06-24T08:23:52.000Z,"With the weekend creeping closer nobody is relaxing just yet as these students get their hands dirty with some practical tasks on their City & Guilds Accredited Electrical Course!

More Info:https://ableskills.co.uk/electrician-training-courses/…#electrical#cityandguilds#ableskills",Unknown,Unknown,Unknown,Unknown,"#electrical, #cityandguilds, #ableskills",@ableskills,https://t.co/n365NZ2SCk,hashtag_2021,neutral
https://x.com/ableskills/status/1404790641683570692,2021-06-15T13:19:23.000Z,"Check out these students who are getting involved in some practical tasks while working towards their Electrician Qualification with us at Able Skills!

Click here to learn more:https://ableskills.co.uk/electrician-training-courses/…#electrician#ableskills#cityandguilds",Unknown,Unknown,Unknown,Unknown,"#electrician, #ableskills, #cityandguilds",@ableskills,https://t.co/n365NZ2SCk,hashtag_2021,neutral
https://x.com/TutorPodcast/status/1384987442105683971,2021-04-21T21:48:32.000Z,"Smug Mode engaged, as Magic Paul (the village postman) delivered my 4#cityandguildscertificates today.
Arguably more satisfying than my First Class Honours Degree - how odd am I?
Discuss.#tutoring#electrician#guitar#teacher",Unknown,Unknown,Unknown,Unknown,"#cityandguilds, #tutoring, #electrician, #guitar, #teacher",@TutorPodcast,,hashtag_2021,positive
https://x.com/APAIRLtd/status/1400754805438664704,2021-06-04T10:02:25.000Z,"Find us inside the latest issue of Commercial Vehicle Workshop Magazine, which is out today.#advert#airconparts#training#mobileaircon#CommercialVehicles#cityandguilds",Unknown,Unknown,Unknown,Unknown,"#advert, #airconparts, #training, #mobileaircon, #CommercialVehicles, #cityandguilds",@APAIRLtd,,hashtag_2021,neutral
https://x.com/APAIRLtd/status/1405887685101817858,2021-06-18T13:58:38.000Z,"We've got the expertise and equipment to help you get your#CityandGuildsLevel 3#Diagnosisand Repair of#MobileAirConditioningSystems (7543-02) qualification.
For course info & availability01453 891320 and ask for Dave.#trainingrig#testbench#technicaltraining",Unknown,Unknown,Unknown,Unknown,"#CityandGuilds, #Diagnosis, #MobileAirConditioning, #trainingrig, #testbench, #technicaltraining",@APAIRLtd,,hashtag_2021,positive
https://x.com/CGServices/status/1440635791403732994,2021-09-22T11:15:13.000Z,We can help!! For all of your training requirements please call 0844 335 6433#training#gettrained#NPORS#cityandguilds#CPCS#streetworks#healthandsafety@CITB_UK,Unknown,Unknown,Unknown,Unknown,"#training, #gettrained, #NPORS, #cityandguilds, #CPCS, #streetworks, #healthandsafety","@CGServices, @CITB_UK",,hashtag_2021,positive
https://x.com/CGServices/status/1428673974276341762,2021-08-20T11:03:13.000Z,"*2 spaces available*
Entry and Working in Confined Spaces@CGServices26th August
£155+vat per person#confinedspaces#training#cityandguilds#gettrained",Unknown,Unknown,Unknown,Unknown,"#confinedspaces, #training, #cityandguilds, #gettrained","@CGServices, @CGServices",,hashtag_2021,neutral
https://x.com/JessicaMeekCCN/status/1405458869875359746,2021-06-17T09:34:41.000Z,Celebrating today as Jade passed her radiography exam with 96% Yay!!! Congratulations and well done for all the hard work#dentalnursediploma#cityandguilds#exams,Unknown,Unknown,Unknown,Unknown,"#dentalnursediploma, #cityandguilds, #exams",@JessicaMeekCCN,,hashtag_2021,positive
https://x.com/APAIRLtd/status/1404788209456930816,2021-06-15T13:09:43.000Z,"When it comes to agri & construction vehicle#airconit has to behttp://apairltd.com50,000 AC parts & tools#Sanden#Denso#Bergstrom#Spal#RedDotdistributorSupply & install#R134a#R1234yf#ACservicemachines#CityandGuildstrainingNext day UK delivery",Unknown,Unknown,Unknown,Unknown,"#aircon, #Sanden, #Denso, #Bergstrom, #Spal, #RedDot, #R134a, #R1234yf, #ACservicemachines, #CityandGuilds",@APAIRLtd,https://t.co/zXAti5bcGQ,hashtag_2021,neutral
https://x.com/APAIRLtd/status/1440698779485683724,2021-09-22T15:25:30.000Z,Welcome to@Landbased_EngTechnician of the Year#competitionwinners Laura from@ErnestDoeSons& Lauren from@chandlersfeThey're studying with us for their#CityandGuilds7543-01 Level 3 award in basic#mobileaircon& 7543-02 Level 3 in diagnosis & repair of mobile aircon.,Unknown,Unknown,Unknown,Unknown,"#competition, #CityandGuilds, #mobileaircon","@APAIRLtd, @Landbased_Eng, @ErnestDoeSons, @chandlersfe",,hashtag_2021,positive
https://x.com/ekpma/status/1434894053007667204,2021-09-06T14:59:35.000Z,"Did you know that you can collect#NRoSOpoints by attending our match? 
Come to the Secretary's tent on the day to sign in and collect yours. 
Great too that@HousehamSprayerwill be with us as a trade stand.#farming#agriculture#spraying#nationalregister#cityandguilds",Unknown,Unknown,Unknown,Unknown,"#NRoSO, #farming, #agriculture, #spraying, #nationalregister, #cityandguilds","@ekpma, @HousehamSprayer",,hashtag_2021,positive
https://x.com/JessicaMeekCCN/status/1388153273241280522,2021-04-30T15:28:25.000Z,Lovely to be back@norwichcollegefor#CPRand#firstaidtraining#dentalnurse#cityandguilds#Apprenticeship,Unknown,Unknown,Unknown,Unknown,"#CPR, #firstaid, #dentalnurse, #cityandguilds, #Apprenticeship","@JessicaMeekCCN, @norwichcollege",,hashtag_2021,positive
https://x.com/JacquiDoddsArt/status/1452532831301799937,2021-10-25T07:09:48.000Z,Fabulous weekend at@westhopecollegeteaching City & Guilds Printmaking. We have been making one colour linoprints and preparing prints to make book covers#printmaking#linoprint#linoprinting#cityandguilds#cityandguildsprintmaking#westhopecollege,Unknown,Unknown,Unknown,Unknown,"#printmaking, #linoprint, #linoprinting, #cityandguilds, #cityandguildsprintmaking, #westhopecollege","@JacquiDoddsArt, @westhopecollege",,hashtag_2021,positive
https://x.com/VA_TRAINING/status/1461284527960117250,2021-11-18T10:45:55.000Z,"Can we help your business this autumn?
Give our team a call today to have a discussion - 01609 882408.#training#partfunding#northyorkshire#yorkshire#york#eastriding#courses#autumn#lantra#cityandguilds",Unknown,Unknown,Unknown,Unknown,"#training, #partfunding, #northyorkshire, #yorkshire, #york, #eastriding, #courses, #autumn, #lantra, #cityandguilds",@VA_TRAINING,,hashtag_2021,neutral
https://x.com/Making_Futures/status/1446777286825553923,2021-10-09T09:59:19.000Z,Excited to be at@BakewellWoolBakewell Wool Gathering this weekend! If you would like to find out more about our@cityandguildsknitting introductory and foundation programmes please come along to say hello :-)#knitting#design#course#qualification#cityandguilds,Unknown,Unknown,Unknown,Unknown,"#knitting, #design, #course, #qualification, #cityandguilds","@Making_Futures, @BakewellWool, @cityandguilds",,hashtag_2021,positive
https://x.com/BlueLightsLtd/status/1465667442856894466,2021-11-30T13:02:03.000Z,"Some great news to kick off Training Tuesdays!

A team effort has seen the Blue Lights Digital DTAC 1 (Digital Tactical Adviser) course and Intelligence Researchers Programme both assured by City & Guilds.#bluelightsdigital#digital#trainingtuesdays#CityandGuilds#assured",Unknown,Unknown,Unknown,Unknown,"#bluelightsdigital, #digital, #trainingtuesdays, #CityandGuilds, #assured",@BlueLightsLtd,,hashtag_2021,positive
