Tweet URL,Created At,Text,Tweet ID,Likes,Retweets,Replies,Hashtags,Mentions,URLs,tag
https://x.com/UWEBristol/status/1692555475521339662,2023-08-18T15:14:06.000Z,"Former inmates will have an opportunity to earn a qualification in enterprise and entrepreneurship, as well as obtain work experience, thanks to a free course provided by UWE Bristol and Project ReMake, funded by@cityandguilds.

Read morehttps://brnw.ch/21wBMsn",Unknown,Unknown,Unknown,Unknown,,"@UWEBristol, @cityandguilds",https://t.co/SfaK2KSMaD,mention_2023
https://x.com/TheClinkCharity/status/1729880483507687491,2023-11-29T15:10:21.000Z,"Please take 5 minutes to watch this short film from@cityandguilds, featuring Clink Graduate Carrie talking about her journey from addiction to rehabilitation and employment. 

We're so proud of Carrie and all our Graduates who commit to long-term change:",Unknown,Unknown,Unknown,Unknown,,"@TheClinkCharity, @cityandguilds","https://t.co/qS4rwQk89I, https://t.co/qS4rwQk89I",mention_2023
https://x.com/FENews/status/1714919413235793949,2023-10-19T08:20:24.000Z,"This article explores how digital credentials and blockchain technology have the potential to reshape the Further Education (FE) landscapeBy Matt Rogers, Service Delivery Manager at@cityandguildsRead more below",Unknown,Unknown,Unknown,Unknown,,"@FENews, @cityandguilds","https://t.co/essoNAFfOo, https://t.co/essoNAFfOo",mention_2023
https://x.com/cityandguilds/status/1722279368867840441,2023-11-08T15:46:14.000Z,"Our Client Manager,@Gibson1Paulashares her thoughts on#cipdACEduring an interview with@LNwireat our stand. We can't wait to share it with you all.
 
In the meantime, chat with our team to explore more industry insights.
 
Visit our stand (E36) today.@cityandguilds",Unknown,Unknown,Unknown,Unknown,#cipdACE,"@cityandguilds, @Gibson1Paula, @LNwire, @cityandguilds","https://www.cityandguilds.com/news/november-2023/training-trends-2023, https://www.cityandguilds.com/news/november-2023/training-trends-2023",mention_2023
https://x.com/AnthropyUK/status/1711325128657658365,2023-10-09T10:18:00.000Z,We'll uncover what's needed to foster inclusive & equitable workplaces where everyone can contribute & thrive & explore ways to embed learning & skills development across the prison estate & encourage more employers to offer opportunities to ex-offenders@cityandguilds#Anthropy,Unknown,Unknown,Unknown,Unknown,#Anthropy,"@AnthropyUK, @cityandguilds",,mention_2023
https://x.com/cityandguilds/status/1709558983302754508,2023-10-04T13:19:58.000Z,"Thank you to everyone who attended and participated in our events at#CPC23@cityandguildshad a fantastic time talking to MPs and attendees at the Conference’s first ever#SkillsHubabout skills development, and the important work of the Future Skills Coalition.#ThankYou",Unknown,Unknown,Unknown,Unknown,"#CPC23, #SkillsHub, #ThankYou","@cityandguilds, @cityandguilds","https://cityandguildsfoundation.org/voice-for-skills/future-skills-coalition/, https://cityandguildsfoundation.org/voice-for-skills/future-skills-coalition/",mention_2023
https://x.com/FENews/status/1628674046962413573,2023-02-23T08:32:06.000Z,Transparency and understanding will help the#ApprenticeshipLevydebate and its potential reform | This is a really interesting article by Mark Cameron from@5PercentClubUKunpacking the recent 'Levying Up' report from 5% Club &@cityandguilds,Unknown,Unknown,Unknown,Unknown,#ApprenticeshipLevy,"@FENews, @5PercentClubUK, @cityandguilds","https://t.co/No6ujoqT9G, https://t.co/No6ujoqT9G",mention_2023
https://x.com/FENews/status/1628705514518376448,2023-02-23T10:37:09.000Z,Lords Blunkett and Johnson to speak at Mind the Skills Gap event |@JoJohnsonUK@LordBlunkett@cityandguilds@AoC_info@AELPUK@K_DonnellyCEO@AoCDavidH@janehickieAELPhttps://fenews.co.uk/skills/mind-the-skills-gap-2/#.Y_dBgtdRyxs.twitter…,Unknown,Unknown,Unknown,Unknown,https://fenews.co.uk/skills/mind-the-skills-gap-2/#.Y_dBgtdRyxs.twitter…,"@FENews, @JoJohnsonUK, @LordBlunkett, @cityandguilds, @AoC_info, @AELPUK, @K_DonnellyCEO, @AoCDavidH",https://t.co/rmQ1VYCES7,mention_2023
https://x.com/AnthropyUK/status/1712132700465930557,2023-10-11T15:47:00.000Z,"Everyone deserves the chance to attain the same education, opportunities & goals, unhampered by individual barriers. We will welcome organisations inc.@DFNFoundation@SeeAbility@porternovelli@Fleishman@cityandguilds@2020levels& more to discuss Our Equity of Opportunity.",Unknown,Unknown,Unknown,Unknown,,"@AnthropyUK, @DFNFoundation, @SeeAbility, @porternovelli, @Fleishman, @cityandguilds, @2020levels",,mention_2023
https://x.com/citylit/status/1645698396424896512,2023-04-11T08:00:47.000Z,"The countdown is on! Only a few days until Deaf Day 2023 kicks off with lots of exciting events planned. We hope you can join us!

Find out more:https://citylit.ac.uk/deaf-dayA big thanks to our sponsors:@LipspeakerUK,@SignatureDeaf,@SignVideoand@cityandguilds",Unknown,Unknown,Unknown,Unknown,,"@citylit, @LipspeakerUK, @SignatureDeaf, @SignVideo, @cityandguilds",https://t.co/Uum2JyhNz6,mention_2023
https://x.com/Bikeworksuk/status/1666413487646547972,2023-06-07T11:55:10.000Z,"With more people cycling, we need more skilled#cyclemechanicsin#London& beyond

Take a look at our introductory@cityandguildsmechanics course:https://bikeworks.org.uk/cityandguilds-level1/…#ActiveTravel#GreenJobs",Unknown,Unknown,Unknown,Unknown,"#cyclemechanics, #London, #ActiveTravel, #GreenJobs","@Bikeworksuk, @cityandguilds",https://t.co/Dyz2jWOBX1,mention_2023
https://x.com/cityandguilds/status/1711516689861332996,2023-10-09T22:59:11.000Z,"Thanks to everyone who attended our Future Skills Coalition#Lab23reception earlier.

It was inspiring hearing speeches from the three founding organisations@cityandguilds,@AoC_info&@AELPUKand@anna4labour, as we gathered to reflect on the importance of skills.",Unknown,Unknown,Unknown,Unknown,#Lab23,"@cityandguilds, @cityandguilds, @AoC_info, @AELPUK, @anna4labour","https://cityandguildsfoundation.org/voice-for-skills/party-conferences/, https://cityandguildsfoundation.org/voice-for-skills/party-conferences/",mention_2023
https://x.com/ColegauCymru/status/1666025935508758529,2023-06-06T10:15:10.000Z,"Together with@quals_wales, ColegauCymru is pleased to be hosting an information sharing and best practice event to support the delivery of the new construction qualifications.https://colleges.wales/en/blog/post/information-sharing-and-best-practice-event-to-support-the-delivery-of-new-construction-qualifications…@KellyLEdwards24@davehagendyk@Rachel_Cable7@cityandguilds@EAL_Awards",Unknown,Unknown,Unknown,Unknown,,"@ColegauCymru, @quals_wales, @KellyLEdwards24, @davehagendyk, @Rachel_Cable7, @cityandguilds",https://t.co/5PtRytYKjP,mention_2023
https://x.com/Bikeworksuk/status/1727696454616068113,2023-11-23T14:31:48.000Z,"Through the Future Neighbourhoods project two@RBKCresidents achieved their City & Guilds Level 1 Cycle Mechanics Qualification. 

We're running funded courses in 2024, sign up here:https://bikeworks.org.uk/socialcycling/#1684491831793-1c004ec2-c00a…@LDN_Environment@cityandguilds#bikeworks",Unknown,Unknown,Unknown,Unknown,"https://bikeworks.org.uk/socialcycling/#1684491831793-1c004ec2-c00a…, #bikeworks","@Bikeworksuk, @RBKC, @LDN_Environment, @cityandguilds",https://t.co/bkzApTQKoo,mention_2023
https://x.com/TweetFaiza/status/1708510320094748842,2023-10-01T15:52:57.000Z,Great to be with@AnnLimbkicking off@cityandguilds#skillshubwith Future Skills Coalitionhttps://cityandguildsfoundation.org/voice-for-skills/future-skills-coalition/…,Unknown,Unknown,Unknown,Unknown,#skillshub,"@TweetFaiza, @AnnLimb, @cityandguilds",https://t.co/8PiGGtWcSa,mention_2023
https://x.com/Bikeworksuk/status/1624040445616574466,2023-02-10T13:39:50.000Z,"Our first#socialcyclingLevel 1@cityandguildsmechanics cohort!well done team!

If you live in@RBKC& want to brush up on your cycle maintenance skills for free >> take a look herehttps://bikeworks.org.uk/socialcycling/@DalgarnoTrust@KCSocialCouncil@KC_Times",Unknown,Unknown,Unknown,Unknown,#socialcycling,"@Bikeworksuk, @cityandguilds, @RBKC, @DalgarnoTrust, @KCSocialCouncil, @KC_Times",https://t.co/eQwXmygfY4,mention_2023
https://x.com/BITC/status/1712779292239618223,2023-10-13T10:36:19.000Z,"Delighted to be joining@cityandguilds' panel conversation at@AnthropyUK(1-3 Nov), which is all about building inclusive workforces to support prisoner rehab:https://anthropy.uk. At BITC we're working to empower employers to broaden their recruitment horizons...(1/2)",Unknown,Unknown,Unknown,Unknown,,"@BITC, @cityandguilds, @AnthropyUK",https://t.co/Bpx8pd9Hgp,mention_2023
https://x.com/ColegauCymru/status/1666025935835918336,2023-06-06T10:15:11.000Z,Ynghyd â@cymwysterau_cymmae ColegauCymru yn falch o gynnal digwyddiad rhannu gwybodaeth ac arfer gorau i gefnogi cyflwyno’r cymwysterau adeiladu newydd.https://colegau.cymru/cy/blog/post/information-sharing-and-best-practice-event-to-support-the-delivery-of-new-construction-qualifications…@KellyLEdwards24@davehagendyk@Rachel_Cable7@cityandguilds@EAL_Awards,Unknown,Unknown,Unknown,Unknown,,"@ColegauCymru, @cymwysterau_cym, @KellyLEdwards24, @davehagendyk, @cityandguilds",https://t.co/UgLrqAvMiQ,mention_2023
https://x.com/StemShow/status/1684622984281985024,2023-07-27T17:53:12.000Z,"MINI THREAD:
I have news. I'm increasing my method of helping the industry. I learnt a long time ago that itching on social media achieves very little. You actually need to do something about it. I started helping@cityandguildsas an associate and have moderated colleges marks,",Unknown,Unknown,Unknown,Unknown,,"@StemShow, @cityandguilds",,mention_2023
https://x.com/cityandguilds/status/1708030167539757101,2023-09-30T08:05:00.000Z,"Happy#InternationalPodcastDayDid you know that@cityandguildshas a podcast called#CityVoices, available on all major platforms?

Thanks to all our amazing guests for sharing their insights during these episodes!#Podcasts#IPD2023",Unknown,Unknown,Unknown,Unknown,"#InternationalPodcastDay, #CityVoices, #Podcasts, #IPD2023","@cityandguilds, @cityandguilds","https://www.cityandguilds.com/events/podcasts, https://www.cityandguilds.com/events/podcasts",mention_2023
https://x.com/KreftRudhlas/status/1622532401757822976,2023-02-06T09:47:24.000Z,"It’s official, I passed my teacher training course!!!@cityandguilds#AET#trainer#facilitator@CornwallCollege",Unknown,Unknown,Unknown,Unknown,"#AET, #trainer, #facilitator","@KreftRudhlas, @cityandguilds, @CornwallCollege",,mention_2023
https://x.com/AnnLimb/status/1713079338894028868,2023-10-14T06:28:36.000Z,Thanks to@cityandguilds@K_DonnellyCEO@FaizaK@AELPUK@AoCDavidH#FutureSkillsCoalition& partners@LTEgrp@Lifelong_Ed@LearnWorkUK@educationgovuk@SeemaMalhotra1the party conferences mark a historic moment for our sector,Unknown,Unknown,Unknown,Unknown,#FutureSkillsCoalition,"@AnnLimb, @cityandguilds, @K_DonnellyCEO, @AELPUK, @AoCDavidH, @LTEgrp, @Lifelong_Ed, @LearnWorkUK, @educationgovuk, @SeemaMalhotra1","https://t.co/lDml0DUBNp, https://t.co/lDml0DUBNp",mention_2023
https://x.com/TheYorksTimes/status/1691366628141715456,2023-08-15T08:30:02.000Z,HRH The Princess Royal Recognises 8 Organisations In Y&H For Outstanding Training And Skills Development@cityandguildshttps://yorkshiretimes.co.uk/article/HRH-The-Princess-Royal-Recognises-8-Organisations-In-YH-For-Outstanding-Training-…,Unknown,Unknown,Unknown,Unknown,,"@TheYorksTimes, @cityandguilds",https://t.co/uELOs36mLl,mention_2023
https://x.com/msnaomiphillips/status/1711809003599085589,2023-10-10T18:20:44.000Z,Finish a super busy#LabourConference23talking about the future of#skills&#apprenticeshipswith Emily Austin@stmartinsgroup@AmazingAppsUKat@cityandguilds#SkillsHub.@LearnWorkUKare doing research to follow this on apprenticeship outcomeshttps://learningandwork.org.uk/resources/research-and-reports/apprenticeships-outcomes-report/…#lab23,Unknown,Unknown,Unknown,Unknown,"#LabourConference23, #skills, #apprenticeships, #SkillsHub, #lab23","@msnaomiphillips, @stmartinsgroup, @AmazingAppsUK, @cityandguilds, @LearnWorkUK","https://t.co/gFldu1AeEH, https://t.co/gFldu1AeEH, https://t.co/gFldu1AeEH",mention_2023
https://x.com/ukEdge/status/1627977690526650369,2023-02-21T10:25:02.000Z,"‘Young people are in crisis right now, they’re feeling like they’re out of control and they’re anxious about their futures.’@YEUK2012’s Youth Voice Census being presented at our Youth Voice Research Showcase this morninghttps://youthemployment.org.uk/youth-voice-census/…@cityandguilds@KingsECS",Unknown,Unknown,Unknown,Unknown,,"@ukEdge, @YEUK2012, @cityandguilds, @KingsECS",https://t.co/rojaRuXuUR,mention_2023
https://x.com/ukEdge/status/1627981101053489152,2023-02-21T10:38:35.000Z,‘At every point we can turn the curve for young people experiencing disadvantage.’@cityandguildstalking about their Youth Misspent report at our Youth Voice Research Showcasehttps://cityandguilds.com/news/december-2022/youth-misspent-uncovering-harsh-realities-for-britains-young-people-in-todays-job-market…@YEUK2012@KingsECS,Unknown,Unknown,Unknown,Unknown,,"@ukEdge, @cityandguilds, @YEUK2012, @KingsECS",https://t.co/vM0tlFYFno,mention_2023
https://x.com/ukEdge/status/1627975952704610308,2023-02-21T10:18:08.000Z,‘A significant number of learners surveyed said digital skills were not developed in school.’@kat_emmstalking about our new research: The perspectives of learnershttps://edge.co.uk/research/projects/research-reports/the-perspectives-of-learners-how-are-schools-developing-employability-skills/…At our youth voice research showcase@cityandguilds@YEUK2012@KingsECS,Unknown,Unknown,Unknown,Unknown,,"@ukEdge, @kat_emms, @cityandguilds, @YEUK2012, @KingsECS",https://t.co/5cDxd7wRxl,mention_2023
https://x.com/cityandguilds/status/1692534845157630397,2023-08-18T13:52:07.000Z,"#SkillsForWalessees@cityandguildsand @EAL_Awards working together to develop new#Constructionand Building Services Engineering qualifications in Wales.

Find out more about how they are being delivered at@BridgendCollegewith@PersimmonHomes",Unknown,Unknown,Unknown,Unknown,"#SkillsForWales, #Construction","@cityandguilds, @cityandguilds, @BridgendCollege, @PersimmonHomes","https://www.youtube.com/watch?v=A_Hq92PXtWA&t=1s, https://www.youtube.com/watch?v=A_Hq92PXtWA&t=1s",mention_2023
https://x.com/themediamentor/status/1731628722157928544,2023-12-04T10:57:14.000Z,At Media Mentor we are very proud of our@cityandguildsqualification!Head of Policy & Communications at City & Guilds Group:https://bit.ly/3uLJJa3#mediajobsCD: 03/01,Unknown,Unknown,Unknown,Unknown,#mediajobs,"@themediamentor, @cityandguilds",https://t.co/XvBbMshO2b,mention_2023
https://x.com/DrLaurenPadgett/status/1669029328435257360,2023-06-14T17:09:35.000Z,"As part of a cohort of@BradfordMuseumscolleagues, I completed a 2 day@Shipley_Collegecourse on Customer Service. Passed the exams this afternoon (double distinction) gaining a Level 2@cityandguildsCertificate in Customer Service. Thanks for the opportunity@SonjaKielty.",Unknown,Unknown,Unknown,Unknown,,"@DrLaurenPadgett, @BradfordMuseums, @Shipley_College, @cityandguilds, @SonjaKielty",,mention_2023
https://x.com/FENews/status/1667145257652240388,2023-06-09T12:22:58.000Z,"#ICYMI:@cityandguildsis rolling out the next stage of its £1m Big Idea Fund, inviting expressions of interest from charities, prison governors, and training providers.

The goal is to support the reskilling of prisoners, ensuring they go on to lead rewarding and fulfilling",Unknown,Unknown,Unknown,Unknown,#ICYMI,"@FENews, @cityandguilds",,mention_2023
https://x.com/arabnews/status/1683847252505231367,2023-07-25T14:30:44.000Z,".@COEKSA, which aims to provide world-class employment prospects to#Saudis, signs an agreement with the@cityandguildsto help develop skills by providing technical training solutions",Unknown,Unknown,Unknown,Unknown,#Saudis,"@arabnews, @COEKSA, @cityandguilds","https://t.co/cddVG3hHUW, https://t.co/cddVG3hHUW",mention_2023
https://x.com/cityandguilds/status/1732355201535819902,2023-12-06T11:04:00.000Z,"Are you interested in Next steps for post-16 education, training and skills in Wales?@cityandguilds' Angharad Lloyd Beynon, will be among an impressive panel discussing the priorities for education, training and research.@wfpevents@AngharadCandG",Unknown,Unknown,Unknown,Unknown,,"@cityandguilds, @cityandguilds, @wfpevents, @AngharadCandG","https://www.policyforumforwales.co.uk/conference/Post-16-Wales-23, https://www.policyforumforwales.co.uk/conference/Post-16-Wales-23",mention_2023
https://x.com/FedsEducation/status/1732558078896132343,2023-12-07T00:30:10.000Z,Great podcast@cityandguilds@hairfed,Unknown,Unknown,Unknown,Unknown,,"@FedsEducation, @cityandguilds, @hairfed",,mention_2023
https://x.com/GordonMarsden/status/1711345200918860050,2023-10-09T11:37:45.000Z,"Had a busy morning#Lab23in Liverpool@NEONHE@HEPI_news& coming up@cityandguildsfringe meetings, some great topics where I articulated@right2_learnhopes for lifelong learning under Labour Govt . Looking  forward to our fringe event tonight w David Blunkett & advisors",Unknown,Unknown,Unknown,Unknown,#Lab23,"@GordonMarsden, @NEONHE, @HEPI_news, @cityandguilds, @right2_learn",,mention_2023
https://x.com/SocialCareWales/status/1645715854024212482,2023-04-11T09:10:10.000Z,"There's still time to register for our early years and childcare spring school for managers, deputies and team leaders. 
Join us in:Cardiff - 18 AprilSt Asaph - 25 April 
With guest speakers from@care_wales@cityandguilds&@wjec_cbacMore:http://ow.ly/mogr50NFFBr",Unknown,Unknown,Unknown,Unknown,,"@SocialCareWales, @care_wales, @cityandguilds, @wjec_cbac",https://t.co/zvW7FCs5y1,mention_2023
https://x.com/maccalarena/status/1627980686140268544,2023-02-21T10:36:56.000Z,".@TweetFaizaon@cityandguilds#YouthMisspentresearch: ""While the findings are stark, young people are telling us what they want; they are giving us the solutions. We can't afford not to listen.""",Unknown,Unknown,Unknown,Unknown,#YouthMisspent,"@maccalarena, @TweetFaiza, @cityandguilds",,mention_2023
https://x.com/FedsEducation/status/1732886562038231118,2023-12-07T22:15:26.000Z,Our CEO Adam Sloan@cityandguilds@adamsloanbigyin,Unknown,Unknown,Unknown,Unknown,youtube.comThe Noble Barber #highlightsThe Noble Barber Podcast is joined by this week's guest @adamsloan5 talking #barberindustry #barbertruths #socialmedia #viralbarberpodcast NEW EPISODE OUT NO...,"@FedsEducation, @cityandguilds, @adamsloanbigyin, youtube.comThe Noble Barber #highlightsThe Noble Barber Podcast is joined by this week's guest @adamsloan5 talking #barberindustry #barbertruths #socialmedia #viralbarberpodcast NEW EPISODE OUT NO...","https://t.co/3VfeZf7UGe, https://t.co/3VfeZf7UGe",mention_2023
https://x.com/Activate_Learn/status/1683552628834197506,2023-07-24T19:00:00.000Z,"Earlier this academic year, Activate Apprenticeships, a part of the Activate Learning group, announced that they have officially been recognised as an Approved EPA Provider by@cityandguildsfor their excellence in apprenticeship delivery.",Unknown,Unknown,Unknown,Unknown,,"@Activate_Learn, @cityandguilds",,mention_2023
https://x.com/SkillsAcadWales/status/1721992166505844912,2023-11-07T20:45:00.000Z,CongratulationsLlongyfarchiadau Henry JonesAward Proudly Sponsored by@Cityandguilds#SAWAwards2023@Colegycymoedd@RCTCouncil,Unknown,Unknown,Unknown,Unknown,#SAWAwards2023,"@SkillsAcadWales, @Cityandguilds, @RCTCouncil",,mention_2023
https://x.com/AngharadCandG/status/1723391080807141448,2023-11-11T17:23:47.000Z,Penblwydd hapus | Happy Birthday@cityandguilds,Unknown,Unknown,Unknown,Unknown,,"@AngharadCandG, @cityandguilds",,mention_2023
https://x.com/AngharadCandG/status/1722394000781382068,2023-11-08T23:21:44.000Z,Llongyfarchiadau mawr i ti Henry - such an imspirational story and highly deserved@cityandguilds#SAWAwards2023,Unknown,Unknown,Unknown,Unknown,#SAWAwards2023,"@AngharadCandG, @cityandguilds",,mention_2023
https://x.com/EALAwards/status/1720078028330643753,2023-11-02T13:58:54.000Z,"Visiting#AEUK23today? 

Don’t forget to head to stand Y161 to find out how best to engage with Engineering & Manufacturing T Levels to benefit your business.@EAL&@cityandguildsexperts on hand!#AdvancedEngineering#TLevels#Engineering#Manufacturing",Unknown,Unknown,Unknown,Unknown,"#AEUK23, #AdvancedEngineering, #TLevels, #Engineering, #Manufacturing","@EALAwards, @EAL, @cityandguilds",,mention_2023
https://x.com/Gibson1Paula/status/1722688104421548100,2023-11-09T18:50:24.000Z,Really enjoyed the CIPD conference this week!@cityandguilds@ILM_UKand talking to@learninglive_ru,Unknown,Unknown,Unknown,Unknown,,"@Gibson1Paula, @cityandguilds, @ILM_UK, @learninglive_ru",,mention_2023
https://x.com/citylordmayor/status/1717490135468593341,2023-10-26T10:35:32.000Z,"I'm thrilled to announce the launch of the Lord Mayor's Green Bursary, a collaboration with@cityandguildsand@MerchantTaylor1. This £10,000 annual fund will empower young Londoners to gain green skills and help our city achieve Net Zero. Let's build a greener future together!",Unknown,Unknown,Unknown,Unknown,,"@citylordmayor, @cityandguilds, @MerchantTaylor1",,mention_2023
https://x.com/Novuschange/status/1717222871452283239,2023-10-25T16:53:31.000Z,"Brilliant to see the work that is happening at@HMPBuckleyHallin Horticulture, combining@cityandguildsqualifications with other innovative projects, to offer our learners a whole host of skills and experience that can be used on release.https://novus.ac.uk/news/a-future-career-in-horticulture-for-hmp-buckley-hall-learners/…",Unknown,Unknown,Unknown,Unknown,,"@Novuschange, @HMPBuckleyHall, @cityandguilds",https://t.co/7FdsnY5uhD,mention_2023
https://x.com/WACSworldchefs/status/1694696121304580494,2023-08-24T13:00:15.000Z,Did you catch the last#podcastepisode? Tune in and learn how#digitalcredentialscan help to boost your careerAvailable athttps://bit.ly/3YKd3bXor anywhere you listen to your podcasts#PodcastAlert#ThislsWorldchefs#upskilling#education|@cityandguilds,Unknown,Unknown,Unknown,Unknown,"#podcast, #digitalcredentials, #PodcastAlert, #ThislsWorldchefs, #upskilling, #education","@WACSworldchefs, @cityandguilds","https://t.co/FqRNSjMI1T, https://t.co/FqRNSjMI1T, https://t.co/FqRNSjMI1T",mention_2023
https://x.com/WSP_UK/status/1677320312147390467,2023-07-07T14:15:00.000Z,New research from@_EngineeringUK&@cityandguildsshows the challenges the UK faces in creating our#NetZeroworkforceLess than half of those surveyed believe they have the#skillsrequired to support a zero carbon#energysystem by 2035More,Unknown,Unknown,Unknown,Unknown,"#NetZero, #skills, #energy","@WSP_UK, @_EngineeringUK, @cityandguilds","https://t.co/TkPdBoiBpS, https://t.co/TkPdBoiBpS",mention_2023
https://x.com/cityandguilds/status/1724019021845279087,2023-11-13T10:59:00.000Z,"Are you interested in Next steps for post-16 education, training and skills in Wales?@cityandguilds'@AngharadCandGwill be among an impressive panel discussing education, training and research priorities.

For event information, see below:@wfpevents",Unknown,Unknown,Unknown,Unknown,,"@cityandguilds, @cityandguilds, @AngharadCandG, @wfpevents","https://www.policyforumforwales.co.uk/conference/Post-16-Wales-23, https://www.policyforumforwales.co.uk/conference/Post-16-Wales-23",mention_2023
https://x.com/HiSheriffLondon/status/1657864209877594112,2023-05-14T21:43:23.000Z,"Excellent event@cityandguilds.
An honour to meet Al Crisci, founder@TheClinkCharityand to hear important messages delivered by Ian Blakeman@HMPPentonville,@_JuniorSmart, Ryan Hull and others.",Unknown,Unknown,Unknown,Unknown,,"@HiSheriffLondon, @cityandguilds, @TheClinkCharity, @HMPPentonville, @_JuniorSmart",,mention_2023
https://x.com/FedsEducation/status/1734885606059090077,2023-12-13T10:38:55.000Z,Click here=https://youtu.be/hNo26jBEPjk?si=j8XJp6QgV_k7fr8p…@cityandguilds@hairfed@adamsloanbigyin,Unknown,Unknown,Unknown,Unknown,,"@FedsEducation, @cityandguilds, @hairfed, @adamsloanbigyin",https://t.co/10jzPosXGF,mention_2023
https://x.com/wfpevents/status/1717496609213161489,2023-10-26T11:01:15.000Z,"Are you interested in Next steps for qualifications and assessment reform in Scotland? 

Join#ScotlandPolicyon the 4th December to discuss this with speakers including@SFE_tweets_@cityandguilds@parentforumscot@CollegesScot! 

Conference info:https://scotlandpolicyconferences.co.uk/conference/SPC-Qualification-23…",Unknown,Unknown,Unknown,Unknown,#ScotlandPolicy,"@wfpevents, @SFE_tweets_, @cityandguilds, @parentforumscot, @CollegesScot",https://t.co/Ct4ynCuWR2,mention_2023
https://x.com/EnergyMonitorAI/status/1679544492691693568,2023-07-13T17:33:06.000Z,"UK energy sector workers believe there is a worrying lack of leadership and support to meet the government’s target to decarbonise energy production by 2035, according to new research from@cityandguildsand@_EngineeringUK:https://energymonitor.ai/policy/just-transition/lack-energy-sector-upskilling-uk-net-zero-transition/…:@OllieGordon88",Unknown,Unknown,Unknown,Unknown,,"@EnergyMonitorAI, @cityandguilds, @_EngineeringUK, @OllieGordon88",https://t.co/I0kCCUXEPS,mention_2023
https://x.com/UWEBristol/status/1696822701657075923,2023-08-30T09:50:32.000Z,"Empowering second chances - we partnered with@ProjectRemakeUKto offer ex-offenders transformative entrepreneurial skills and paid placements.

With a@cityandguildsgrant of £67,000, this initiative is changing lives and fostering new opportunities.",Unknown,Unknown,Unknown,Unknown,,"@UWEBristol, @ProjectRemakeUK, @cityandguilds","https://t.co/6sFaqe8n56, https://t.co/6sFaqe8n56",mention_2023
