Tweet URL,Created At,Text,Tweet ID,Likes,Retweets,Replies,Hashtags,Mentions,URLs,tag
https://x.com/CyngorCasnewydd/status/1467826198940209162,2021-12-06T12:00:11.000Z,"Hoffwn longyfarch ein dysgwyr yn Academi Ieuenctid Casnewydd ar gyflawni eu cymwysterau sgiliau hanfodolCity and Guildsmewn mathemateg, Saesneg a chyflogadwyedd.  Da iawn bawb!Darllenwch fwyhttp://newport.gov.uk/aic",Unknown,Unknown,Unknown,Unknown,,@CyngorCasnewydd,https://t.co/8xQywlkWTo,phrase_2021
https://x.com/Karenlatif3/status/1414896952802693124,2021-07-13T10:38:15.000Z,"Officially part of theCity and GuildsFamilia! At the beginning of 2021, I made a promise to myself to focus on my Personal and Career Growth! Learning and building my academic profile has been part of it.",Unknown,Unknown,Unknown,Unknown,,@Karenlatif3,,phrase_2021
https://x.com/NYWELSH/status/1439953814132494340,2021-09-20T14:05:16.000Z,Never to old or late in life to reinvent your self .. just passed my “city and guildslevel 3 domestic energy assessor certification “,Unknown,Unknown,Unknown,Unknown,,@NYWELSH,,phrase_2021
https://x.com/TheCaravanTech1/status/1461796313733992449,2021-11-19T20:39:34.000Z,"A much younger me at Earl's Court caravan show 1984, after a 3 year apprenticeship being presented with myCity and Guildsin caravan engineering 

Myself and a handful of others were the first to receive this so there was a big presentation ceremony",Unknown,Unknown,Unknown,Unknown,,@TheCaravanTech1,,phrase_2021
https://x.com/VRHungwe/status/1468922621131698184,2021-12-09T12:36:58.000Z,"Did you know 
Westridge High
Petra College
Girls College
Hillcrest College 
Falcon College 
Watershed College
Lomagundi College
Peterhouse

Offer Travel and Tourism as a subject/ course within their schools. Some Cambridge, someCity and Guildsor both",Unknown,Unknown,Unknown,Unknown,,@VRHungwe,,phrase_2021
https://x.com/addingadoo87/status/1423302784259133444,2021-08-05T15:20:02.000Z,Got myCity and GuildsCertificate in the post today for Leadership and Management - nice surprise seems a lifetime ago since completing my degree#leadership#management#mba,Unknown,Unknown,Unknown,Unknown,"#leadership, #management, #mba",@addingadoo87,,phrase_2021
https://x.com/NHAG_UKandROI/status/1461649236592939009,2021-11-19T10:55:08.000Z,"Congratulations to Scottish apprentices, John Connolly from Agricar, Dundonald, Craig Farmer from Bryson Tractors, and Keiran Hay from Fife Tractors, who have all successfully completed theirCity and GuildsNational Certificate in Land-based Engineering with New Holland",Unknown,Unknown,Unknown,Unknown,,@NHAG_UKandROI,,phrase_2021
https://x.com/Batarhe/status/1386952420735930370,2021-04-27T07:56:40.000Z,"Every week I get these electrician openings. Abeg if you be electrician for Nigeria, withcity and guildsor OND. Abeg find your way come Australia. You’ll be glad you did. Sparkies  are making a killing eh.",Unknown,Unknown,Unknown,Unknown,,@Batarhe,,phrase_2021
https://x.com/MPCT_HQ/status/1415680078294360075,2021-07-15T14:30:07.000Z,We’re dedicated to unlocking the full potential of our Learners with qualifications fromCity and Guildsand BTEC’s to provide the professional and military skills needed for successful careers.0330 111 3939https://bddy.me/3emaUgs,Unknown,Unknown,Unknown,Unknown,,@MPCT_HQ,https://t.co/zcT1IWiWoU,phrase_2021
https://x.com/HMPAshfield/status/1404423513684037635,2021-06-14T13:00:33.000Z,"We’re pleased to see our carpentry department up and running again. Prisoners get to learn a wide range of carpentry skills that will be useful in gaining employment after prison, along with the opportunity to obtain a Level 1City and GuildsConstruction Skills Qualification.",Unknown,Unknown,Unknown,Unknown,,@HMPAshfield,,phrase_2021
https://x.com/GiftNyirongo17/status/1399285207388274689,2021-05-31T08:42:45.000Z,Hello guys am a qualified designer with a diploma in construction anandipatsa ndi acity and guildslol DM for business.,Unknown,Unknown,Unknown,Unknown,,@GiftNyirongo17,,phrase_2021
https://x.com/cawleys/status/1456228779009916929,2021-11-04T11:56:10.000Z,"Congratulations to Najaid Ali, our Telesales exec who has successfully achieved a Distinction in hisCity and GuildsLevel 3 Business Admin. 
Through hours of hard work Naj put forward an excellent final submission. Here he is with our Managing Director. Well done Naj!!",Unknown,Unknown,Unknown,Unknown,,@cawleys,,phrase_2021
https://x.com/maryhareschool/status/1445731200648290305,2021-10-06T12:42:33.000Z,6th FormCity and Guildsstudents make pizzas for Friday lunchtime.  What better way to start the weekend!#pizzamaking#deafeducation#deafschool,Unknown,Unknown,Unknown,Unknown,"#pizzamaking, #deafeducation, #deafschool",@maryhareschool,,phrase_2021
https://x.com/DavidHuntFCDO/status/1473291822948573186,2021-12-21T13:58:37.000Z,"Brilliant to see#UKhigher education institutions/organisations: GEMS, Cambridge,City and Guilds, University of London sign an agreement to support the#KRGMinistry of Higher Education with a series of free capacity building/training courses.",Unknown,Unknown,Unknown,Unknown,"#UK, #KRG",@DavidHuntFCDO,,phrase_2021
https://x.com/NewportCouncil/status/1467826168032370691,2021-12-06T12:00:04.000Z,"We would like to congratulate our learners at Newport Youth Academy on achieving their essential skillsCity and Guildsqualifications in maths, English and employability. Well done to all!Want to learn a new skill or obtain a qualification? 
Visithttp://newport.gov.uk/nya",Unknown,Unknown,Unknown,Unknown,,@NewportCouncil,https://t.co/xts7OImp3h,phrase_2021
https://x.com/Nescot/status/1425728793239556098,2021-08-12T08:00:07.000Z,"Good luck to everyone getting their results today!Results will be published on Weblearn today for Level 1 and Level 2 qualifications with teacher assessed grades - these include GCSE English and Maths, UAL, BTEC andCity and GuildsTechnicals.#GCSEresults#ResultsDay",Unknown,Unknown,Unknown,Unknown,"#GCSEresults, #ResultsDay",@Nescot,,phrase_2021
https://x.com/PhilipTagoe1/status/1434034283589603330,2021-09-04T06:03:10.000Z,"At BBAB, we expanding our courses, adding the Barista course to all our 6th Form students, improving employability skills. Our students are ready to serve all brands of coffee whilst gaining aCity and Guildsqualification. Thanks to@NeilMillerLSEAT@samparrett1@LSEAcademiesT",Unknown,Unknown,Unknown,Unknown,,"@PhilipTagoe1, @NeilMillerLSEAT, @samparrett1, @LSEAcademiesT",,phrase_2021
https://x.com/CrathernKim/status/1442454991906746371,2021-09-27T11:44:04.000Z,I did a level 3City and Guildsin a health and social care mainly for adults with LD it was a wonderful feeling when I finished it and passed.https://x.com/KingBobIIV/sta/KingBobIIV/status/1442414683013595142…,Unknown,Unknown,Unknown,Unknown,,@CrathernKim,,phrase_2021
https://x.com/CofGCollege/status/1438865676207284225,2021-09-17T14:01:24.000Z,Congratulations to@CofGCollegeengineering apprentices who have achieved theirCity and GuildsDomestic Natural Gas qualifications - despite many months on furlough due to the pandemic...https://socsi.in/y57eQ,Unknown,Unknown,Unknown,Unknown,,"@CofGCollege, @CofGCollege",https://t.co/a0pcIw1rUq,phrase_2021
https://x.com/MPCT_HQ/status/1417854476967456776,2021-07-21T14:30:24.000Z,We’re dedicated to unlocking the full potential of our Learners with qualifications fromCity and Guildsand BTEC’s to provide the professional and military skills needed for successful careers.#WhoWeAre#MakingBetterCitizens0330 111 3939https://bddy.me/3zk05DJ,Unknown,Unknown,Unknown,Unknown,"#WhoWeAre, #MakingBetterCitizens",@MPCT_HQ,https://t.co/qdIP3E2lTS,phrase_2021
https://x.com/__TheRetreat/status/1448163829834256384,2021-10-13T05:48:57.000Z,"We are looking for a dynamic forward thinking
professional Senior Spa Therapist to join our team.

You must be qualified in Beauty Therapy to NVQ Level 3, ITEC,City and Guilds, BABTAC or CIDESCO with at least five years industry experience#jobscornwall@madeforlife_",Unknown,Unknown,Unknown,Unknown,#jobscornwall,"@__TheRetreat, @madeforlife_",,phrase_2021
https://x.com/WorcsApprentice/status/1461019818530856969,2021-11-17T17:14:03.000Z,"Achieve your Level 2 or 3City and GuildsTech and Digital Qualification
Online, flexible, fully-funded and free for learners aged 19+ in#WorcestershireFind out more:https://buff.ly/3lKU0uZ",Unknown,Unknown,Unknown,Unknown,#Worcestershire,@WorcsApprentice,https://t.co/FGBYTqqlFW,phrase_2021
https://x.com/OllieDouglas/status/1463932126932443138,2021-11-25T18:06:32.000Z,Basket makers visiting@TheMERLtoday as parts of theirCity and Guildscourse.,Unknown,Unknown,Unknown,Unknown,,"@OllieDouglas, @TheMERL",,phrase_2021
https://x.com/furness_college/status/1434798547866619905,2021-09-06T08:40:05.000Z,"NEW ADULT COURSE - INTRO TO HAIR AND BEAUTY. Perfect the skills needed to succeed with our 6-weekCity and Guildsevening course covering: Hair styling, Nails, Make Up, Beauty Therapy. Many places are free or fully funded. Email businesssupport@furness.ac.uk or call 01229 825017.",Unknown,Unknown,Unknown,Unknown,,@furness_college,,phrase_2021
https://x.com/Nescot/status/1425022059227328514,2021-08-10T09:11:49.000Z,"Results will be published on Weblearn today for Level 3 Diplomas and Extended Diplomas for UAL, BTEC, AIM Awards, NCFE/Cache, as well as AQA Level 3 Mathematics andCity and GuildsTechnicals.
 
Good luck to everyone getting their results today!",Unknown,Unknown,Unknown,Unknown,,@Nescot,,phrase_2021
https://x.com/DrVLindsay7/status/1435231804684914692,2021-09-07T13:21:42.000Z,Visiting a U.K. school in Baghdad this morning to find out more about teacher training in Iraq - exploring how organisations such asCity and Guildscould support teacher development.@StirlingEdu@IBBC_London@tradegovukMEAP@cityandguilds@foranewiraq,Unknown,Unknown,Unknown,Unknown,,"@DrVLindsay7, @StirlingEdu, @IBBC_London, @tradegovukMEAP, @cityandguilds, @foranewiraq",,phrase_2021
https://x.com/LeonRousseau10/status/1397252581760638980,2021-05-25T18:05:49.000Z,City and Guildsin making a toastie.,Unknown,Unknown,Unknown,Unknown,,@LeonRousseau10,,phrase_2021
https://x.com/WorcsApprentice/status/1440621182663860228,2021-09-22T10:17:10.000Z,"Tech and Digital pre-Apprenticeship Programme in#Worcestershire, Achieve yourCity and GuildsLevel 3 qualification and start your career in the fast growing tech & digital sector with The Development Managerhttps://buff.ly/3lKU0uZ",Unknown,Unknown,Unknown,Unknown,#Worcestershire,@WorcsApprentice,https://t.co/FGBYTq8Khm,phrase_2021
https://x.com/davidkehoe13/status/1430526189739913225,2021-08-25T13:43:16.000Z,Fantastic day with keith Langton making samples forCity and Guildsfor the plastering qualification massive thanks to Keith and his team@KLLangton,Unknown,Unknown,Unknown,Unknown,,"@davidkehoe13, @KLLangton",,phrase_2021
https://x.com/AssessmentRM/status/1458840701186232330,2021-11-11T16:55:01.000Z,"#FAB2021Awards tonight! Good luck to all the finalists in the EPAO of the year category: Training Qualifications UK (@tq_uk),City and Guilds(@cityandguilds),@SFJAwards,@FDQ1, Highfield Awarding Body for Compliance, and@cmi_managers!",Unknown,Unknown,Unknown,Unknown,#FAB2021,"@AssessmentRM, @tq_uk, @cityandguilds, @SFJAwards, @FDQ1, @cmi_managers","https://t.co/hn0ACMJc7e, https://t.co/hn0ACMJc7e",phrase_2021
https://x.com/CoreYouthServ/status/1409898390826242050,2021-06-29T15:35:45.000Z,City and Guildsbike mechanics day 2. Brakes session,Unknown,Unknown,Unknown,Unknown,,@CoreYouthServ,,phrase_2021
https://x.com/hopwoodhall/status/1424670294082469889,2021-08-09T09:54:01.000Z,"Tomorrow 10th August we are releasing Level 3 results for BTEC, UAL, NCFE Technical andCity and GuildsTechnical.

Thursday 12th August we are releasing BTEC Level 1 and Level 2 as well as Level 2 results for UAL, NCFE Technical,City and GuildsTechnical and GCSE’s.",Unknown,Unknown,Unknown,Unknown,,@hopwoodhall,,phrase_2021
https://x.com/SLCek/status/1458107293384511488,2021-11-09T16:20:43.000Z,"Looks amazing!

Well done Level 1City and GuildsPainting studentshttps://x.com/arobin33/statu/arobin33/status/1458076700898697222…",Unknown,Unknown,Unknown,Unknown,,@SLCek,,phrase_2021
https://x.com/DomGar18/status/1374133067237982209,2021-03-22T22:57:08.000Z,Aht aht aht this why i picked up somecity and guildssubjects because just in case jamaica doesn't work outhttps://x.com/trevsenpai/sta/trevsenpai/status/1374114416879362056…,Unknown,Unknown,Unknown,Unknown,,@DomGar18,,phrase_2021
https://x.com/CoreYouthServ/status/1419992278769315846,2021-07-27T12:05:16.000Z,"City and Guildsbike mechanics level 2. Bottom bracket module exam.
They aced it.",Unknown,Unknown,Unknown,Unknown,,@CoreYouthServ,,phrase_2021
https://x.com/WYP_HBrear/status/1466387968466300931,2021-12-02T12:45:10.000Z,Team accountability with my National Police Promotion Framework team. We are working alongside 125 officers to  achieve Level 4/5City and Guildsaccreditation.Honour to work alongside hard working teams who always go the extra mile to meet our force strategy/ needs.,Unknown,Unknown,Unknown,Unknown,,@WYP_HBrear,,phrase_2021
https://x.com/_Babington/status/1443123551482130438,2021-09-29T08:00:41.000Z,Based on research conducted by CEBR for@stmartinsgroupin partnership with@NCFEandCity and Guilds: around 60% of business recognised apprenticeships as a viable path to employment.https://babington.co.uk/blog/employers/the-st-martins-group-employers-state-apprentices-bring-significant-benefits/…#Apprenticeships#Employment#Apprentice#DevelopingBetterFutures,Unknown,Unknown,Unknown,Unknown,"#Apprenticeships, #Employment, #Apprentice, #DevelopingBetterFutures","@_Babington, @stmartinsgroup, @NCFE",https://t.co/qHN7yQxiXK,phrase_2021
https://x.com/concisetraining/status/1450007499755687937,2021-10-18T07:55:02.000Z,Wishing all our wonderful learners who have recently embarked on theirCity and GuildsDiploma in Social Media for Business the very best of luck - your journey to exciting new beginnings has started!#socialmedia#digitalmarketing#distancelearning,Unknown,Unknown,Unknown,Unknown,"#socialmedia, #digitalmarketing, #distancelearning",@concisetraining,,phrase_2021
https://x.com/BathCollege/status/1446081632864284674,2021-10-07T11:55:02.000Z,"Did you know our Adult Community Learning courses include horticulture? This week theCity and GuildsHorticulture students have been working in Victoria Park with Bath based charity Grow for Life.#MyBathCollegeFor more info on our ACL courses, visithttp://bathcollege.ac.uk/adult-community-learning…",Unknown,Unknown,Unknown,Unknown,#MyBathCollege,@BathCollege,https://t.co/noeAhybS50,phrase_2021
https://x.com/Befuggled/status/1428273744808665092,2021-08-19T08:32:51.000Z,"My older daughter, Emma's latest piece of stone carving atCity and Guildsof London Art School. We are very grateful for the support she has received from The Queen Elizabeth Scholarship Trust.",Unknown,Unknown,Unknown,Unknown,,@Befuggled,,phrase_2021
https://x.com/MPCT_HQ/status/1405504704759619585,2021-06-17T12:36:49.000Z,"We’re dedicated to unlocking the full potential of our Learners with qualifications fromCity and Guildsand BTEC’s to provide the professional and military skills needed for successful careers. 
We’re proud to work with our Awards providers to provide life-changing learning.",Unknown,Unknown,Unknown,Unknown,,@MPCT_HQ,,phrase_2021
https://x.com/turner_trees/status/1375747824034357248,2021-03-27T09:53:36.000Z,AnotherCity and Guildscertificate in digital technologies#KPT,Unknown,Unknown,Unknown,Unknown,#KPT,@turner_trees,,phrase_2021
https://x.com/riseholmecampus/status/1397915500835840006,2021-05-27T14:00:02.000Z,OurCity and GuildsLevel 3 in Equine Management students had an end-of-year team building fun day at Combat Zone Paintball!#bemoreatriseholme#teambuilding#equine#equinestudent,Unknown,Unknown,Unknown,Unknown,"#bemoreatriseholme, #teambuilding, #equine, #equinestudent",@riseholmecampus,,phrase_2021
https://x.com/WYP_HBrear/status/1425819757769539584,2021-08-12T14:01:35.000Z,Well done Tara- Public order team Having achieved your Level 3 in TeachingCity and Guilds.,Unknown,Unknown,Unknown,Unknown,,@WYP_HBrear,,phrase_2021
https://x.com/Proud_Sappers/status/1389142798469844994,2021-05-03T09:00:26.000Z,"Did you know you could get FREE Professional Recognition Awards with@RECPDUK?Corporals and above, you could be eligible for aCity and Guildsqualification. Visithttp://re-cpd.org.ukto start your#RECPDchallengetoday.#MondayMotivation",Unknown,Unknown,Unknown,Unknown,"#RECPDchallenge, #MondayMotivation","@Proud_Sappers, @RECPDUK",https://t.co/3n0dDvwznt,phrase_2021
https://x.com/stannescck/status/1381911900674478081,2021-04-13T10:07:26.000Z,St Anne’s TY students attending aCity and GuildsBarista Training Course at LCETB’s Further Education Centre. Great new skill to learn.#learnanewskill,Unknown,Unknown,Unknown,Unknown,#learnanewskill,@stannescck,,phrase_2021
https://x.com/HomeInsteadHant/status/1438828734694494219,2021-09-17T11:34:37.000Z,"More training taking place in the office this week with our newest CAREGivers, teaching them all they need to know!We Provide Award-Winning Training + Learning & development opportunities including Parkinson's UK developed training andCity and GuildsDementia Course!",Unknown,Unknown,Unknown,Unknown,,@HomeInsteadHant,,phrase_2021
https://x.com/CabHarlow/status/1423234304352657412,2021-08-05T10:47:55.000Z,Congratulations to Barbara who has successfully completed herCity and GuildsLevel 3 Award in Energy Awareness#TeamHarlow,Unknown,Unknown,Unknown,Unknown,#TeamHarlow,@CabHarlow,,phrase_2021
https://x.com/YeovilCollege/status/1468967778145095698,2021-12-09T15:36:25.000Z,"Peter Thomas, Chair of the Yeovil College Corporation presents the@YeovilUniCentreAwards on behalf of The Association of Accounting Technicians, Association of Chartered Certified Accountants,City and Guildsand Pearson Education.#YCUCGraduation@YeovilUniCentre",Unknown,Unknown,Unknown,Unknown,#YCUCGraduation,"@YeovilCollege, @YeovilUniCentre, @YeovilUniCentre",,phrase_2021
https://x.com/RIG_Systems/status/1412740850422104066,2021-07-07T11:50:40.000Z,"It was a pleasure to deliver the new (6160-03)City and GuildsWorking in High Risk Confined Spaces Training Course to South Western Ambulance Services (HART) last month, at our training facility. We captured some of the tasks that they carried out during their training.",Unknown,Unknown,Unknown,Unknown,,@RIG_Systems,,phrase_2021
https://x.com/HCFCatch/status/1441369960740122626,2021-09-24T11:52:32.000Z,"CATCH are pleased to announce we are nowCity and Guildsaccredited!

For more information on our training courses please contact the team on 01469 552852",Unknown,Unknown,Unknown,Unknown,,@HCFCatch,,phrase_2021
https://x.com/KenningtonRUN/status/1418627533105422339,2021-07-23T17:42:15.000Z,"Plaster cast in the window ofCity and Guildsart school, Kennington Park Rd.@CGLArtSchool",Unknown,Unknown,Unknown,Unknown,,"@KenningtonRUN, @CGLArtSchool",,phrase_2021
https://x.com/ic_communists/status/1445320002849189889,2021-10-05T09:28:36.000Z,Our stall is all set up at the Imperial College Welcome Fair! Come and find us atCity and Guilds(Mechanical Engineering),Unknown,Unknown,Unknown,Unknown,,@ic_communists,,phrase_2021
https://x.com/KEITS_Training/status/1394901803700002817,2021-05-19T06:24:40.000Z,"Are you aware that KEITS provides Teaching, Training and Coaching CPD?

TheCity and Guilds6502 Award in Education and Training is a recognized qualification for those who want to pursue a role in a range of educational settings.https://keits.co.uk/city-guilds-education-and-training.php…",Unknown,Unknown,Unknown,Unknown,,@KEITS_Training,https://t.co/yKZUyxOnb5,phrase_2021
https://x.com/CoreYouthServ/status/1443915652067172361,2021-10-01T12:28:12.000Z,"Wheel Building as part of ourCity and Guildsbike Mechanics Program.
@RotharPhibsboro",Unknown,Unknown,Unknown,Unknown,,@CoreYouthServ,,phrase_2021
https://x.com/Q4HW_official/status/1448967067110105089,2021-10-15T11:00:43.000Z,"MASSIVE CONGRATULATIONSto the wonderful Tamsin Woodhead-  VAC's Quality & Engagement Lead, who was awarded theCity and GuildsLevel 4 Award in the Internal Quality Assurance of Assessment Processes and Practice! 

Keep up the great work Tamsin#Quality4HealthWellbeing",Unknown,Unknown,Unknown,Unknown,#Quality4HealthWellbeing,@Q4HW_official,,phrase_2021
https://x.com/KenningtonRUN/status/1428395776695279623,2021-08-19T16:37:46.000Z,"It’s our fave time of year, theCity and Guildsgraduate show in Kennington Park Road. It is free and open all weekend! A real hoot.",Unknown,Unknown,Unknown,Unknown,,@KenningtonRUN,,phrase_2021
https://x.com/decodingloyalty/status/1404764008201207814,2021-06-15T11:33:33.000Z,"Our co-award winners,City and Guilds, share their thoughts on what loyalty means to them.

If you missed our podcast, you can listen to it here:https://lnkd.in/ebDKeks#crx#mrx#B2B#b2bmarketing#loyalty#research#segmentation",Unknown,Unknown,Unknown,Unknown,"#crx, #mrx, #B2B, #b2bmarketing, #loyalty, #research, #segmentation",@decodingloyalty,https://t.co/wZzAhxvtva,phrase_2021
https://x.com/nwrc_college/status/1470445915395608579,2021-12-13T17:30:00.000Z,Congratulations to our catering staff at Strand Road who completedCity and GuildsLevel 2 in Food Safety and Hygiene as part of their professional development and upskilling.,Unknown,Unknown,Unknown,Unknown,,@nwrc_college,,phrase_2021
https://x.com/MalungaZinhle/status/1454381807164665860,2021-10-30T09:36:58.000Z,"Congratulations to our CEO Gratitude Zinhle Malunga for successfully completing aCity and GuildsDiploma in Food Preparation and Culinary Arts at  ctia-chefs:Chefs Training and Innovation Academy
An International qualification registered in the United Kingdom",Unknown,Unknown,Unknown,Unknown,,@MalungaZinhle,,phrase_2021
https://x.com/Malone_Group/status/1430829344818147332,2021-08-26T09:47:53.000Z,Niamh Walsh DipNEBOSH recently completed the CIFcity and GuildsAssured Temporary Works Coordinator Programme.#construction#safety#contractors#constructionindustry,Unknown,Unknown,Unknown,Unknown,"#construction, #safety, #contractors, #constructionindustry",@Malone_Group,,phrase_2021
https://x.com/MPCT_HQ/status/1409496885514182657,2021-06-28T13:00:19.000Z,We’re dedicated to unlocking the full potential of our Learners with qualifications fromCity and Guildsand BTEC’s to provide the professional and military skills needed for successful careers.0330 111 3939https://bddy.me/2T6TGfWText MPCT to 88008,Unknown,Unknown,Unknown,Unknown,,@MPCT_HQ,https://t.co/e0MZBZhSN2,phrase_2021
https://x.com/DeborahFarquhar/status/1425362346864750593,2021-08-11T07:44:00.000Z,One child finished theirCity and Guildsin Mechanics and the other going to Inverness to study.  One very proud Mum,Unknown,Unknown,Unknown,Unknown,,@DeborahFarquhar,,phrase_2021
https://x.com/katevtg/status/1372943543334010881,2021-03-19T16:10:23.000Z,News on chainsaw certification -https://mailchi.mp/0a625a46ad23/news-on-chainsaw-certificationNews…fromcity and guildson chainsaw certification,Unknown,Unknown,Unknown,Unknown,,@katevtg,https://t.co/SXXfIEY1cv,phrase_2021
https://x.com/Proud_Sappers/status/1361993991953211392,2021-02-17T11:00:46.000Z,"Did you know you could get FREE Professional Recognition Awards with RE CPD?

Get recognised for your engineering expertise! Corporals and above with two years experience in rank, you could be eligible for aCity and Guildsqualification.http://re-cpd.org.uk/professional-recognition-awards…#SapperSmart",Unknown,Unknown,Unknown,Unknown,#SapperSmart,@Proud_Sappers,https://t.co/qRpJQX2pHF,phrase_2021
https://x.com/bespokebeheard/status/1402619836841275403,2021-06-09T13:33:23.000Z,"City and GuildsL2 Certificate in cycle mechanics: frame swap- complete strip down and rebuild with a test ride at the end; excellent job Christos! 
.
.
.@cityandguilds#bicyclemechanics#bikemaintenance#cycletechnician#bicycleservice#cityandguilds#BESPOKEbeHEARD",Unknown,Unknown,Unknown,Unknown,"#bicyclemechanics, #bikemaintenance, #cycletechnician, #bicycleservice, #cityandguilds, #BESPOKEbeHEARD","@bespokebeheard, @cityandguilds",,phrase_2021
https://x.com/TomSyvret/status/1434945635795537920,2021-09-06T18:24:34.000Z,Indeed and proper pre 1980 ones not ruddy NVQ’s. It is increasingly difficult to find anyone fully trained in all aspects of their trade unless they have been fortunate enough to have learnt everything from an olderCity and Guildscraftsperson (equality),Unknown,Unknown,Unknown,Unknown,,@TomSyvret,,phrase_2021
https://x.com/KentAdultEd/status/1438095584712400901,2021-09-15T11:01:20.000Z,"Progress your career in Interior Design with our AccreditedCity and GuildsLevel 2 course in Sevenoaks. Our tutor will teach you skills from drawing to costing, as well as helping you develop your design ideas. Book your place here:http://ow.ly/6swC50G8QRC#Kent#AdultEd",Unknown,Unknown,Unknown,Unknown,"#Kent, #AdultEd",@KentAdultEd,https://t.co/rQdItQ32u3,phrase_2021
https://x.com/KentAdultEd/status/1439197864647970821,2021-09-18T12:01:24.000Z,Create your own textile designs from fashion to soft furnishings and gain aCity and GuildsLevel 1 award on our Accredited Textile Decoration course in Tonbridge. Book your place here:http://ow.ly/PPcT50G8Rso#Kent#AdultEd,Unknown,Unknown,Unknown,Unknown,"#Kent, #AdultEd",@KentAdultEd,https://t.co/QI2GlgPVo1,phrase_2021
https://x.com/KentAdultEd/status/1434426231731232768,2021-09-05T08:00:38.000Z,"Gain a qualification in Interior Design on ourCity and GuildsLevel 2 Certificate course. Students will be taught recognised methods, drawing, elevation plans, creating swatch boards, costing and researching materials. Book here:http://ow.ly/51Tm50G2SZB#Kent#AdultEd",Unknown,Unknown,Unknown,Unknown,"#Kent, #AdultEd",@KentAdultEd,https://t.co/39FPCEKaQp,phrase_2021
