Tweet URL,Created At,Text,Tweet ID,Likes,Retweets,Replies,Hashtags,Mentions,URLs,tag
https://x.com/EAS_Scotland/status/1470755708228763651,2021-12-14T14:01:00.000Z,One of our tasks this week is to randomly select 20 people from the 360 that took part in our one day training during Nov/Dec for a fully fundedCity and GuildsCourse on Energy Awareness. We'll keep you posted.,Unknown,Unknown,Unknown,Unknown,,@EAS_Scotland,,phrase_2021
https://x.com/Gertsroyals/status/1436286344934871083,2021-09-10T11:12:04.000Z,"CC Thursday:

The Princess Royal, President, theCity and Guildsof London Institute, this evening attended a Dinner held by The Prince Charles, Duke of Rothesay at Dumfries House, Cumnock, Ayrshire.",Unknown,Unknown,Unknown,Unknown,,@Gertsroyals,,phrase_2021
https://x.com/EAS_Scotland/status/1471528898198441990,2021-12-16T17:13:23.000Z,"We've selected, at random, 20 people from 20 different organisations for funded by@OVOEnergy@YourSSE onCity and GuildsEnergy Awareness. Emails went out earlier today. Studies start in January and first exam sittings are in Feb. Good luck everyone.",Unknown,Unknown,Unknown,Unknown,,"@EAS_Scotland, @OVOEnergy",,phrase_2021
https://x.com/destinyjxde/status/1425123185968680960,2021-08-10T15:53:39.000Z,Imagine my whole class not receiving our exam results bcoscity and guildshas decided our course isn’t valid anymore after making us sit 5 full day long exams,Unknown,Unknown,Unknown,Unknown,,@destinyjxde,,phrase_2021
https://x.com/FETBishopstown/status/1388172949207797761,2021-04-30T16:46:36.000Z,"Currently recruiting for suitably qualified people to deliverCity and Guildsand QQI certified training in the areas of *Professional Bartending , restaurant & Barista Skills .must have qualification in the area ,relevant work experience & Training experience",Unknown,Unknown,Unknown,Unknown,,@FETBishopstown,,phrase_2021
https://x.com/EAS_Scotland/status/1460195246055346186,2021-11-15T10:37:30.000Z,Good luck toCity and GuildsEnergy Awareness candidates from @SouthSeeds@ChangeworksUKsitting this with us today.,Unknown,Unknown,Unknown,Unknown,,"@EAS_Scotland, @ChangeworksUK",,phrase_2021
https://x.com/adamsloanbigyin/status/1450207610834235393,2021-10-18T21:10:12.000Z,"The Mhfed & HairFed , collectively FedsEducation, are honoured to continue to work in association withCity and Guilds. 
We are looking forward to our upcoming HairShow in Essex. 
We also have some exciting collaborative projects with City & Guilds   in 2…https://lnkd.in/emm7GtUE",Unknown,Unknown,Unknown,Unknown,,@adamsloanbigyin,https://t.co/KfPUm3UIPg,phrase_2021
https://x.com/EAS_Scotland/status/1457660509642178569,2021-11-08T10:45:22.000Z,Good luck to all of those candidates sittingCity and Guilds#EnergyAwarenessexams today@ChangeworksUK@SouthSeeds Alness Citizens Advice,Unknown,Unknown,Unknown,Unknown,#EnergyAwareness,"@EAS_Scotland, @ChangeworksUK",,phrase_2021
https://x.com/BRUFC_Academy/status/1426124223295143939,2021-08-13T10:11:25.000Z,Congratulations to all our alumni that got their A Level BTECCity and Guildsand diploma results this week we are immensely proud of you all. Same goes to our new recruits who picked up their GCSE results yesterday were looking forward to hearing all about your plans at training,Unknown,Unknown,Unknown,Unknown,,@BRUFC_Academy,,phrase_2021
https://x.com/proogs/status/1456612841939742721,2021-11-05T13:22:18.000Z,"City and Guildsnow seem to just issue a Credly page URL to show candidates have achieved things. You can click 'verify' and it mutters about blockchain - and then it dumps a .json for you to view raw in a browser.
Am I missing something? I just want to view their certificate!",Unknown,Unknown,Unknown,Unknown,,@proogs,,phrase_2021
https://x.com/water_king10/status/1475636165210431494,2021-12-28T01:14:12.000Z,And the politician can't find work for you if you failCity and Guilds,Unknown,Unknown,Unknown,Unknown,,@water_king10,,phrase_2021
https://x.com/GJ_MediaJobs/status/1466133825197641734,2021-12-01T19:55:18.000Z,"Project Editor - London (Central), London (Greater) -CITY and GUILDShttps://jobs.theguardian.com/job/7513662/project-editor/?TrackID=13&utm_source=twitterfeed&utm_medium=feed&utm_campaign=897018…",Unknown,Unknown,Unknown,Unknown,,@GJ_MediaJobs,https://t.co/YvzIMpnXVx,phrase_2021
https://x.com/adamsloanbigyin/status/1446499171410882569,2021-10-08T15:34:11.000Z,"Feds Education in Association withCity and Guildsare putting on a Hair/Barber Show, April 10th, 2022, Palace Theatre, Westcliff-On-Sea, Essex. 
Super excited to cut through all the bureaucracy and paperwork that is too prevelant in our industry and deli…",Unknown,Unknown,Unknown,Unknown,"linkedin.comAdam Sloan on LinkedIn: #education #creativity #event #hair #barbering #fashion #show #students…Feds Education in Association with City and Guilds are putting on a Hair/Barber Show, April 10th, 2022, Palace Theatre, Westcliff-On-Sea, Essex. Super excited…",@adamsloanbigyin,"https://t.co/KCxtJ7m35r, https://t.co/KCxtJ7m35r",phrase_2021
https://x.com/CambridgesNews/status/1449662626154303490,2021-10-17T09:04:38.000Z,"Court Circular
10th September, 2021:
The Prince Charles, Duke of Rothesay, President, The Prince’s Foundation, and The Princess Royal, President, theCity and Guildsof London Institute, this morning attended a Reception at Dumfries House, Cumnock, Ayrshire, [•••] 1/7",Unknown,Unknown,Unknown,Unknown,,@CambridgesNews,,phrase_2021
https://x.com/CAKEPD1/status/1465758109050228745,2021-11-30T19:02:20.000Z,Our delivery/assessment of ourCity and GuildsLearning and Development qualification has been given Direct Claim status from@cityandguildsalong with all our other ILM qualifications. Our open  L&D practitioner programme launches in Spring  22,Unknown,Unknown,Unknown,Unknown,,"@CAKEPD1, @cityandguilds",,phrase_2021
https://x.com/BookkeeperForum/status/1438203848267481091,2021-09-15T18:11:32.000Z,Looking for a Trainer who can teachCity and Guilds:City and guildsteaches the basics but will not in itself open any doors to employment and it would not prepare people properly for self emplyment. To give your students a good chance at the job market…http://dlvr.it/S7dbgQ,Unknown,Unknown,Unknown,Unknown,,@BookkeeperForum,https://t.co/kPWrUZPmTH,phrase_2021
https://x.com/Grumpcake/status/1448264453859037185,2021-10-13T12:28:47.000Z,"Hah! I did employment training. I gotcity and guildsqualifications. When my eldest had a careers talk, which I was present at, the youth connexions man told him ""you can get a C&G for making a cup of tea nowadays, they're rubbish. He's doing bTechs now.",Unknown,Unknown,Unknown,Unknown,,@Grumpcake,,phrase_2021
https://x.com/Wiblicks/status/1422644871890882567,2021-08-03T19:45:43.000Z,We are watching@More4#GrandDesignand as we are on our second rented home we have been asked to leave; we are going to take our £200 and £15 pounds on scratch cards (My PinkCity and GuildsQualification in construction) & build our own house & in build our own house.,Unknown,Unknown,Unknown,Unknown,#GrandDesign,"@Wiblicks, @More4",,phrase_2021
https://x.com/MxSpite/status/1471648522688737280,2021-12-17T01:08:44.000Z,"Me, realizing one year after that being made fun for my entrance essay toCity and Guildsof London Art School was pretty crusty behavior, and no matter how good the program & life in London sounded, getting bullied for a neurodivergent trait is yikes behavior?",Unknown,Unknown,Unknown,Unknown,,@MxSpite,,phrase_2021
https://x.com/peaky_script/status/1458215323866308611,2021-11-09T23:30:00.000Z,Michael didCity and Guilds- six months.,Unknown,Unknown,Unknown,Unknown,,@peaky_script,,phrase_2021
