Tweet URL,Created At,Text,Tweet ID,Likes,Retweets,Replies,Hashtags,Mentions,URLs,tag
https://x.com/RIG_Systems/status/1064843765096026112,2018-11-20T11:31:52.000Z,"Check out our current course calendar!  IncludesCity and GuildsLevel 2 Award in Working in Medium Risk Confined Spaces (Top Man) (Entrant) (6150-02),City and GuildsLevel 2 Award in Working in High Risk Confined Spaces (6150-03)…https://lnkd.in/dYDu855https://lnkd.in/dK_FmRe",Unknown,Unknown,Unknown,Unknown,,@RIG_Systems,"https://t.co/YilKicapsZ, https://t.co/8k904IV4yi",phrase_2018
https://x.com/SocEntKent/status/1020026752188416005,2018-07-19T19:25:03.000Z,"Are you considering study?  But the costs of childcare, travel or life might prevent you,City and Guildshave bursaries of up to £10,000 available apply on the link below.#study@cityandguilds#learning#ILMhttp://ow.ly/TqdY30kZqtO",Unknown,Unknown,Unknown,Unknown,"#study, #learning, #ILM","@SocEntKent, @cityandguilds",https://t.co/qKpecOF3MB,phrase_2018
https://x.com/adamsloanbigyin/status/1057054589999038467,2018-10-29T23:40:28.000Z,"MHFed are proud to releaseCity and GuildsQualified Barber of the Year and the National Trainee Barbers of the Year from Scotland, Northern Ireland, Wales and England Competitions.…https://instagram.com/p/BpiSn4ZhU-b/?utm_source=ig_twitter_share&igshid=19vi6h2fcz7w6…",Unknown,Unknown,Unknown,Unknown,,@adamsloanbigyin,https://t.co/gnZvDeZtsM,phrase_2018
https://x.com/adamsloanbigyin/status/1036008488323796992,2018-09-01T21:50:46.000Z,MHFed /City and GuildsTrainee Barber of the Year 2019 will be taking part in a Shoot assisted by some chosen Feds.working with our media partners  @BarberNV_Mag . Watch this space for…https://instagram.com/p/BnMv9rXHivY/?utm_source=ig_twitter_share&igshid=2npst7pgqmdp…,Unknown,Unknown,Unknown,Unknown,,@adamsloanbigyin,https://t.co/KCHNokpzEn,phrase_2018
https://x.com/ChaiquintaPets/status/1076145310110498818,2018-12-21T16:00:10.000Z,"Hi, Sophie B hereThese are a couple of dogs that I have groomed at The College of Animal Welfare where I am completing my level 3city and guildsdog grooming course.

I love it...https://facebook.com/chaiquintagroomingsalon/posts/2294841790540381…",Unknown,Unknown,Unknown,Unknown,,@ChaiquintaPets,https://t.co/g2E6kyx5Er,phrase_2018
https://x.com/AsifAAhmad/status/1025351331408699392,2018-08-03T12:03:02.000Z,City and Guildsdeveloping engineering in Jamaicahttp://jamaicaobserver.com/news/ministry-partners-with-city-and-guilds-for-engineering-qualification_140267?profile=1373…@cityandguilds,Unknown,Unknown,Unknown,Unknown,,"@AsifAAhmad, @cityandguilds",https://t.co/d4igh6NVoc,phrase_2018
https://x.com/GSAPInfo/status/1070351393628790784,2018-12-05T16:17:13.000Z,City and GuildsLevel 2 Introductory Awareness to ASC.- Free Training at GSAPhttps://shantallow.net/events/city-and-guilds-level-2-introductory-awareness-to-asc-free-training-at-gsap…,Unknown,Unknown,Unknown,Unknown,,@GSAPInfo,https://t.co/ZAM9SgvQuj,phrase_2018
https://x.com/StephLunch/status/1029749727137603584,2018-08-15T15:20:41.000Z,"I have talked aboutCity and Guilds, NVQs etc all day.",Unknown,Unknown,Unknown,Unknown,,"@StephLunch, @BusinessStudies, @BBCNews",,phrase_2018
https://x.com/adamsloanbigyin/status/1058880698625474560,2018-11-04T00:36:46.000Z,MHFed are excited to launchCity and GuildsTrainee Barber of the Year and the new  Qualified Barber of the Year. Please go tohttps://mhfed.com/barber-of-the-year-competition-2019/……https://instagram.com/p/BpvQQ6zBDmm/?utm_source=ig_twitter_share&igshid=1dtvznwgq3tlt…,Unknown,Unknown,Unknown,Unknown,,@adamsloanbigyin,"https://t.co/O5hQvJCFkx, https://t.co/CrxmMqj9kF",phrase_2018
https://x.com/Learn_Inspire/status/1075346177946730498,2018-12-19T11:04:42.000Z,"NEW Maths Functional Skills Course added! FREE!
Perfect for those who haven't achieved GCSE grade C and above & would like to boost job prospects. You will work towards theCity and GuildsFunctional Skills qualification at either level 1 or 2. Book:https://bit.ly/2QF7qvW",Unknown,Unknown,Unknown,Unknown,,@Learn_Inspire,https://t.co/TcH70hlZEB,phrase_2018
https://x.com/colettebasketry/status/1018580652206239744,2018-07-15T19:38:46.000Z,"Hanging out with fellow basket nerds at Westhope College Open Day,City and Guildsshow.#Colettebasketry#southwales#monmouthshire#wyevalley#forestofdean#fibreart#fibrebasketry#basketmaker#basketry#vannerie#weaver#locallysourced#crafts#han…https://ift.tt/2Jr6kLI",Unknown,Unknown,Unknown,Unknown,"#Colettebasketry, #southwales, #monmouthshire, #wyevalley, #forestofdean, #fibreart, #fibrebasketry, #basketmaker, #basketry, #vannerie, #weaver, #locallysourced, #crafts, #han",@colettebasketry,https://t.co/thg4cEhdvi,phrase_2018
https://x.com/VTOSKilkenny/status/1009029030115467265,2018-06-19T11:04:02.000Z,Congratulations to Fiona on being awarded aCity and Guildsmedal for excellencehttps://goo.gl/8TsYzEif you are interested in any courses here in VTOS Kilkenny please contact 056-7764719 or visit our websitehttp://vtoskk.iefor more detailshttps://goo.gl/8TsYzE,Unknown,Unknown,Unknown,Unknown,,@VTOSKilkenny,"https://t.co/aRMnWkOTuc, https://t.co/B8gbNurHZd, https://t.co/3GSASs12WP",phrase_2018
https://x.com/Bikeworksuk/status/1052533780433567744,2018-10-17T12:16:23.000Z,"We have one or two places left on ourCity and GuildsEmployability course, starting Nov.1st - gain skills needed to get into work in leisure, hospitality or customer service through work experience at our All Ability clubs. 

Email enquiries@bikeworks.org.uk for more information",Unknown,Unknown,Unknown,Unknown,,@Bikeworksuk,,phrase_2018
https://x.com/worksireland/status/1050702192313860098,2018-10-12T10:58:18.000Z,"City and GuildsQualified Electrical Engineer - Melksham, Wilshire, Ireland -http://ireland.jobrat.net/2018/10/12/city-and-guilds-qualified-electrical-engineer-melksham-wilshire-ireland/…",Unknown,Unknown,Unknown,Unknown,,@worksireland,https://t.co/ikLnWMRNpZ,phrase_2018
https://x.com/sophiereeves1/status/1032275230075613184,2018-08-22T14:36:08.000Z,Been accepted on theCity and guildslevel 2 certificate for dog grooming! Roll on the 9th of September,Unknown,Unknown,Unknown,Unknown,,@sophiereeves1,,phrase_2018
https://x.com/CountrysideJobs/status/1009401728091820032,2018-06-20T11:45:00.000Z,"Training:@lynhertraining: Tree Identification and Planting (City and Guilds/Lynher), Tree Pests and Diseases (City and Guilds/Lynher), Basic Tree Inspection (Lantra) and Tree and Plant Science (City & Guilds/Lynher)http://c-js.info/TDSplant",Unknown,Unknown,Unknown,Unknown,,"@CountrysideJobs, @lynhertraining",https://t.co/4AK2DC3HI6,phrase_2018
https://x.com/iwcponline/status/1069896007855554561,2018-12-04T10:07:40.000Z,Bright sparks at@IslandRoadspassCity and Guildselectrician course.#isleofwighthttps://iwcp.co.uk/news/17274299.island-roads-bright-sparks-pass-city-and-guilds-electrician-course/?ref=twtrec…,Unknown,Unknown,Unknown,Unknown,#isleofwight,"@iwcponline, @IslandRoads",https://t.co/ul5KIwjnSz,phrase_2018
https://x.com/applicationslk/status/1039311184929808384,2018-09-11T00:34:30.000Z,"Bachelor of Engineering, Pearson BTEC,City and GuildsCourses - SLT Training Centreshttps://wp.me/p95yLC-6Vp",Unknown,Unknown,Unknown,Unknown,,@applicationslk,https://t.co/hdIXoKAxIq,phrase_2018
https://x.com/constructionERC/status/1031206180868304897,2018-08-19T15:48:07.000Z,Are any of our educational followers delivering thecity and guildsL2 awards Technicals in Constructing the Built Environment?,Unknown,Unknown,Unknown,Unknown,,@constructionERC,,phrase_2018
https://x.com/the_comp_lady/status/1072462876705726465,2018-12-11T12:07:29.000Z,"I have a group of teens that are studying for Level 1City and Guildsand are looking to get involved in community projects on the Marsh. If anyone has any ideas - e.g  beach clean ups ,helping local parish councils etc please contact us here or pop in. Thanks.",Unknown,Unknown,Unknown,Unknown,,@the_comp_lady,,phrase_2018
https://x.com/busybeespatch/status/1065649597790461953,2018-11-22T16:53:57.000Z,"Ship shape andCity and GuildsFashion for level 2 - Colour Theory for level 1. We have been playing shape and I mean playing, I could do this all day if I had the time, so much...https://blog.busybeespatchwork.com/2018/11/ship-shape-and-city-and-guilds-fashion.html?spref=fb…",Unknown,Unknown,Unknown,Unknown,,@busybeespatch,https://t.co/LppGE6v3t2,phrase_2018
https://x.com/peaky_script/status/1051189578600730624,2018-10-13T19:15:00.000Z,Michael didCity And Guilds- six months.,Unknown,Unknown,Unknown,Unknown,,@peaky_script,,phrase_2018
https://x.com/imperialvenues/status/1045611601766887424,2018-09-28T09:50:07.000Z,"Find out about how fire works at 'The Science of Fire' - a fascinating lecture at Imperial's impressiveCity and GuildsBuilding on Wednesday, 3 October. Places are free, but you'll need to book in advance here:http://ow.ly/iSo930lpBd7#southkensington",Unknown,Unknown,Unknown,Unknown,#southkensington,@imperialvenues,https://t.co/0LhVFF0MVs,phrase_2018
https://x.com/BermondseyCK/status/1034752771231236098,2018-08-29T10:41:00.000Z,"There are still spaces available for our FREECity and GuildsLevel 1 and 2 cookery course.
For 16 - 40 year old's.

For more information please call 0207 232 5111",Unknown,Unknown,Unknown,Unknown,,@BermondseyCK,,phrase_2018
