Tweet URL,Created At,Text,Tweet ID,Likes,Retweets,Replies,Hashtags,Mentions,URLs,tag
https://x.com/BlackSheepWools/status/1462707660881547264,2021-11-22T09:00:56.000Z,"We have a new tutor joining our workshop schedule in 2022 - Sally Hart (previously known as Black Sheep Sally). Sally is a qualifiedCity and Guildstutor, an expert at knitting and crochet. 
Book a place on half day class for beginners at the Craft Barn -http://ow.ly/8ufG50GRHLn",Unknown,Unknown,Unknown,Unknown,,@BlackSheepWools,https://t.co/DWdkVzMmfl,phrase_2021
https://x.com/CWM_YWMW/status/1452252818165882893,2021-10-24T12:37:08.000Z,"Meet Megan Barradell from Twigg Floral Design Ltd... 

""I decided to do aCity and GuildsQualification in Floral Design after I was asked to do the flowers for my best friend’s wedding as her florist was taken ill last minute...https://yourwestmidlands.wedding/wedding-news/20125/meet-megan-barradell-from-twigg-floral-design-ltd…",Unknown,Unknown,Unknown,Unknown,,@CWM_YWMW,https://t.co/0RzOSdSsnB,phrase_2021
https://x.com/S_ERC/status/1393612444195504128,2021-05-15T17:01:13.000Z,"Students on SERC’s foundation learning course have been getting involved with@LeonardCheshire#CanDoProject, which has develop their photography skills and is helping the students achieve aCity and Guildsaccreditation award.http://ow.ly/T1JN50ELNJI#BetterOffAtSERC",Unknown,Unknown,Unknown,Unknown,"#CanDoProject, #BetterOffAtSERC","@S_ERC, @LeonardCheshire",https://t.co/S8kFfjtXKh,phrase_2021
https://x.com/SalfordRanger/status/1438912458442387465,2021-09-17T17:07:18.000Z,A big well done to the volunteers who have all successfully completed theirCity and GuildsPractical Horticulture course at the raised beds in Ordsall Park led by the Salford Ranger Team @SalfordWildlife !@SalfordCouncil@OldhamCollege,Unknown,Unknown,Unknown,Unknown,,"@SalfordRanger, @SalfordCouncil, @OldhamCollege",,phrase_2021
https://x.com/mwasalat_om/status/1467766064213811200,2021-12-06T08:01:14.000Z,"فخورون بحصول ""معهد#مواصلاتللتدريب"" على الاعتماد الدولي من مؤسسة (City and Guilds) والذي يأتي تأكيداً على الالتزام بمعايير الجودة العالمية ليصبح بذلك مركزاً إقليمياً معتمداً",Unknown,Unknown,Unknown,Unknown,#مواصلات,@mwasalat_om,,phrase_2021
https://x.com/LisaOhh1/status/1458488899966324750,2021-11-10T17:37:05.000Z,Do you volunteer in a setting in#northwalesoffering Advice and Guidance? Would you like aCity and Guildsaccredited qualification? If so get in touch northwalespeerhub@stgilestrust.org.Uk now taking applications for next cohort. Spaces are limited#training#development,Unknown,Unknown,Unknown,Unknown,"#northwales, #training, #development",@LisaOhh1,,phrase_2021
https://x.com/CryptLeeds/status/1439176131488456712,2021-09-18T10:35:03.000Z,"As part of his recovery at#GrowingRooms,  Will has been working at#Nurture, our catering arm@CryptLeedsWill recently passed hisCity and Guildscatering course - Level 2 Food Safety & Hygiene for Catering.
We caught up with him for a chat, Read here:https://bit.ly/WherethereisaWill…",Unknown,Unknown,Unknown,Unknown,"#GrowingRooms, #Nurture","@CryptLeeds, @CryptLeeds",https://t.co/RY2kfsuWH3,phrase_2021
https://x.com/WestSuffolk/status/1462825567166808064,2021-11-22T16:49:27.000Z,"New homes will be required to have Electric Vehicle charging stations from 2022.

We're running theCity and Guilds2919 Electric Vehicle Charging qualification in January 2022 - get ahead and get qualified!

Sign up:https://wsc.ac.uk/ev-qual#EV#ElectricCar#EVCharging#Suffolk",Unknown,Unknown,Unknown,Unknown,"#EV, #ElectricCar, #EVCharging, #Suffolk",@WestSuffolk,https://t.co/k4khjdF8In,phrase_2021
https://x.com/RE_Derwen/status/1401883215577718785,2021-06-07T12:46:18.000Z,Joe restocking and rotating stock in the Garden Centre this morning for hisCity and Guildsqualification.#retailandenterprise#derwencollege#workexperiencehttps://instagram.com/p/CP0cifWFL35/?utm_medium=twitter…,Unknown,Unknown,Unknown,Unknown,"#retailandenterprise, #derwencollege, #workexperience","Retail and Enterprise @ Derwen College, @RE_Derwen",https://t.co/cZXOtmI6IU,phrase_2021
https://x.com/CIF_Training/status/1384872328618729472,2021-04-21T14:11:07.000Z,"CIFCity and GuildsBuilding Regulations Programme beginning Thursday, may 27th.",Unknown,Unknown,Unknown,Unknown,,@CIF_Training,,phrase_2021
https://x.com/emmanuelekawume/status/1391765268645490690,2021-05-10T14:41:12.000Z,"THE ESSENCE OF AN AWARD 

"" A Technician's worth is seen in his Work ""

These were the words of Dr Djangmah a former Director-General of the Ghana Education Service, at an Award ceremony organised by theCity and Guildsof London Institutehttps://m.facebook.com/story.php?story_fbid=3900980653271341&id=100000783348238…",Unknown,Unknown,Unknown,Unknown,,@emmanuelekawume,https://t.co/l5xRqhU3k2,phrase_2021
https://x.com/GoldenSafety/status/1418639375290744832,2021-07-23T18:29:18.000Z,"Goldensafety Confined Space Instructors out deliveringCity and Guilds2 day Confined Space Courses this week, Goldensafety raising the standard#Confinedspacetraining#CityandGuilds#Safety#Goldensafety#Scotland#Glasgow#Edinburgh#Dundee#Aberdeen#BritishTelecom#Openreach",Unknown,Unknown,Unknown,Unknown,"#Confinedspacetraining, #CityandGuilds, #Safety, #Goldensafety, #Scotland, #Glasgow, #Edinburgh, #Dundee, #Aberdeen, #BritishTelecom, #Openreach",@GoldenSafety,,phrase_2021
https://x.com/MPCT_HQ/status/1400784442659160065,2021-06-04T12:00:11.000Z,We’re dedicated to unlocking the full potential of our Learners with qualifications fromCity and Guildsand BTEC’s to provide the professional and military skills needed for successful careers.,Unknown,Unknown,Unknown,Unknown,,@MPCT_HQ,,phrase_2021
https://x.com/TheLearnStation/status/1425502917159686149,2021-08-11T17:02:34.000Z,"Today we're talking about the Level 3 Diploma for the Early Years Practitioner (Early Years Educator) course! This course is an Ofqual regulated qualification and accredited byCity and Guilds, a top UK awarding body.",Unknown,Unknown,Unknown,Unknown,,@TheLearnStation,,phrase_2021
https://x.com/TheLearnStation/status/1426227832947097605,2021-08-13T17:03:08.000Z,"Last but not least, we have theCity and GuildsLevel 5 Diploma in Leadership for the Children and Young People's Workforce - Early Years (Management)!Need more info? Check out our website in our bio, give us a call on 0208 342 7210or send a message here!",Unknown,Unknown,Unknown,Unknown,,@TheLearnStation,,phrase_2021
https://x.com/S_ERC/status/1382303015059742720,2021-04-14T12:01:35.000Z,"Tom Dalcz, a Senior Engineer and Construction Manager for#Fichtnerturned his wealth of career knowledge and experience into aCity and GuildsLevel 7 Professional Recognition Award.

Read Tom's story here:http://ow.ly/n6uE50Enh0F#BetterOffAtSERC",Unknown,Unknown,Unknown,Unknown,"#Fichtner, #BetterOffAtSERC",@S_ERC,https://t.co/ILIUJOPMfQ,phrase_2021
https://x.com/WestSuffolk/status/1475771576410951683,2021-12-28T10:12:16.000Z,"New homes will be required to have Electric Vehicle charging stations from 2022.

We're running theCity and Guilds2919 Electric Vehicle Charging qualification in January 2022 - get ahead and get qualified!

Sign up:https://wsc.ac.uk/ev-qual#ElectricVehicle#ChargingPoint",Unknown,Unknown,Unknown,Unknown,"#ElectricVehicle, #ChargingPoint",@WestSuffolk,https://t.co/k4khjdF8In,phrase_2021
https://x.com/NewsFromBW/status/1452926652225228802,2021-10-26T09:14:42.000Z,"Global Corporate M-Learning Market Report 2021, Featuring Adobe Inc.,City and GuildsGroup, Koch Industries Inc. and Learning Pool Ltd. -http://ResearchAndMarkets.comhttp://dlvr.it/SBJnbX",Unknown,Unknown,Unknown,Unknown,,@NewsFromBW,"https://t.co/guyiBzPH8C, https://t.co/6b5XUL6hDh",phrase_2021
https://x.com/Shipley_College/status/1455194154775064578,2021-11-01T15:24:57.000Z,"FREE 2-day Customer Service courses starting soon! Running on 8th & 11th November 9am-5pm at Airedale Enterprise.
> Worldhost Principles of Customer Service
>City and GuildsCustomer Service Level 2 
Book here:https://bit.ly/3w63iGB",Unknown,Unknown,Unknown,Unknown,,@Shipley_College,https://t.co/8UHIo2XAYu,phrase_2021
https://x.com/StartingPoint_/status/1391666841819439104,2021-05-10T08:10:05.000Z,"Learn how to care for children, and get aCity and GuildsLevel Award in Caring for Children to prove it!Impress in your next application with this free short course:http://ow.ly/rKQB50EF3RE",Unknown,Unknown,Unknown,Unknown,,@StartingPoint_,https://t.co/Bm1QPxF3XN,phrase_2021
https://x.com/drmelaniebell/status/1425175541867552771,2021-08-10T19:21:42.000Z,"Me too! I have no A levels but did acity and guildsat 16. I went on later in life to get 3 degrees and have since published books. If you didn't get the results you want/need, try not to panic - do clearing or just take a step back and reassess, it'll be OK",Unknown,Unknown,Unknown,Unknown,,@drmelaniebell,,phrase_2021
https://x.com/StartingPoint_/status/1452994706250600456,2021-10-26T13:45:07.000Z,"Want to work with children? This FREE short course will help you gain the skills you need.Qualification:City and GuildsLevel Award in Caring for Children

Location:
St Helens Chamber

Duration:
6 weekshttp://ow.ly/vskg50Gvh6A",Unknown,Unknown,Unknown,Unknown,,@StartingPoint_,https://t.co/405KfZdOL6,phrase_2021
https://x.com/RIG_Systems/status/1410942603416293376,2021-07-02T12:45:05.000Z,Last week we had the fire services on-site for a visit and the South Western Ambulance Services (HART) team completed theirCity and Guildsworking in High Risk Confined Spaces.https://rigsystems.co.uk/course-categories/Specialist-Rescue/HART-Training/…#emergencyservices#confinedspaces#specialisttraining#ambulanceservice,Unknown,Unknown,Unknown,Unknown,"#emergencyservices, #confinedspaces, #specialisttraining, #ambulanceservice",@RIG_Systems,https://t.co/plaBxXrHiy,phrase_2021
https://x.com/KBSPartnership/status/1456614781209563136,2021-11-05T13:30:01.000Z,"Free Level 2 AwardCity and GuildsIndependent AdvocacyDo you want to help other people be heard when accessing safeguarding services? 
Criteria: Must be over 19 years and a Bristol resident
Contact: lucy.fieldhouse@bristol.gov.uk",Unknown,Unknown,Unknown,Unknown,,@KBSPartnership,,phrase_2021
https://x.com/AldridgeALearn/status/1466346595851636738,2021-12-02T10:00:46.000Z,"Develop your#Englishskills in order to achieve a#FunctionalSkillsqualification at Level 1 or Level 2. 

Register for our FREE#EnglishFunctionalSkillsLevel 1/2City and Guildscourse, starting on 18th January 2022http://ow.ly/7L8c50GX12L#AdultLearning#ChangeYourStory",Unknown,Unknown,Unknown,Unknown,"#English, #FunctionalSkills, #EnglishFunctionalSkills, #AdultLearning, #ChangeYourStory",@AldridgeALearn,https://t.co/KTMhmxPr81,phrase_2021
https://x.com/TDMapprentices/status/1461970328066920454,2021-11-20T08:11:02.000Z,"Only one week left to sign up onto our fully-funded Tech and Digital online Programme for a December startFind out what it is, how it could apply to you or someone you know and how to achieve the Level 2 or 3City and Guildsqualification, herehttps://buff.ly/3kTz5WP",Unknown,Unknown,Unknown,Unknown,,@TDMapprentices,https://t.co/4toickcgT0,phrase_2021
https://x.com/Adrianepdavey/status/1432310612693028869,2021-08-30T11:53:55.000Z,"This is fromCity and Guildsand describes why I think apprenticeships are the best route, as you get real life, hands on experience.

Even the diploma route has low validity if I’m reading this correctly",Unknown,Unknown,Unknown,Unknown,,@Adrianepdavey,,phrase_2021
https://x.com/MarvinJRees/status/1476197344039342080,2021-12-29T14:24:07.000Z,"Do you want to help other people be heard when accessing safeguarding services?@KBSPartnershipand the Community Learning team are offering FREE Level 2City and GuildsIndependent Advocacy qualifications throughout the year

More on today's bloghttps://thebristolmayor.com/2021/12/29/improving-advocacy-in-bristol/…",Unknown,Unknown,Unknown,Unknown,,"@MarvinJRees, @KBSPartnership",https://t.co/MKMKjCUIqO,phrase_2021
https://x.com/JemmaGunning88/status/1449300894739222529,2021-10-16T09:07:14.000Z,"'SPACES IN-BETWEEN' a group exhibition atCity and Guildsof London Art School opens today and is on for the next week. 
If you're in London, pop in and see it!",Unknown,Unknown,Unknown,Unknown,,@JemmaGunning88,,phrase_2021
https://x.com/KenningtonRUN/status/1421527567123812360,2021-07-31T17:45:57.000Z,Today on the Runoff we tell you about the upcoming degree show atCity and Guildsin Kennington. Slightly off the wall and free!@CGLArtSchoolhttps://kenningtonrunoff.com/city-guilds-degree-show/…,Unknown,Unknown,Unknown,Unknown,,"@KenningtonRUN, @CGLArtSchool",https://t.co/bcrV3CdfxN,phrase_2021
https://x.com/coleggwent/status/1474017765518368768,2021-12-23T14:03:15.000Z,"Further your#careeror explore a new one with our huge range ofCity and GuildsNPTC#Landbased,#Equineand#AnimalCarecourses at Usk Campus in the new year!Spaces filling fast, enrol now:http://coleggwent.ac.uk/january",Unknown,Unknown,Unknown,Unknown,"#career, #Landbased, #Equine, #AnimalCare",@coleggwent,https://t.co/5sor5wdaZR,phrase_2021
https://x.com/CrawleyCollege/status/1393234909976801280,2021-05-14T16:01:02.000Z,"If you're working with electrical installations, you should be aware of the latest IEE wiring regulations and how to keep yourself safe!You can do all that by taking our BS7671 18th Edition course recognised and awarded byCity and Guilds. Learn more:http://orlo.uk/PTPfG",Unknown,Unknown,Unknown,Unknown,,@CrawleyCollege,https://t.co/9XMFl6F33v,phrase_2021
https://x.com/CIF_Training/status/1425748269070790659,2021-08-12T09:17:31.000Z,"A#testimonialfrom an attendee on@CIF_IrelandCity and GuildsProject Supervisor for Design Process Course. 
""I certainly feel confident in undertaking the role of PSDP after completing the course.""https://ciftraining.ie/product/project-supervisor-design-process/…#ciftraining#psdp#wellbeing#healthandsafety",Unknown,Unknown,Unknown,Unknown,"#testimonial, #ciftraining, #psdp, #wellbeing, #healthandsafety","@CIF_Training, @CIF_Ireland",https://t.co/lrBYf3hnG4,phrase_2021
https://x.com/Bikeworksuk/status/1455489910249508865,2021-11-02T11:00:10.000Z,"Today is the last chance to book on to the nextCity and GuildsLevel 1 course! Our experienced and friendly tutor will be teaching  at our Velodrome Training Centre next week on Monday, Tuesday and Thursday. 

For more information see the website here:https://bikeworks.org.uk/cityandguilds-level1/…",Unknown,Unknown,Unknown,Unknown,,@Bikeworksuk,https://t.co/Dyz2jWOBX1,phrase_2021
https://x.com/FedsEducation/status/1450208783381278727,2021-10-18T21:14:52.000Z,"The Mhfed & HairFed , collectively FedsEducation, are honoured to continue to work in association withCity and Guilds. 
We are looking forward to our upcoming HairShow in Essex. 
We also have some exciting collaborative projects with City & Guilds   in 2022.@cityandguilds",Unknown,Unknown,Unknown,Unknown,,"@FedsEducation, @cityandguilds",,phrase_2021
https://x.com/riseholmecampus/status/1403366414241742850,2021-06-11T15:00:01.000Z,"Its dayof#farmingfortnightand its#fishyfridayIf you've got a passion for food, enrol on our cookery courses!City and Guildslevel 1 in professional cookeryhttps://bit.ly/2Tp0lBBCity and Guildslevel 2 in professional cookeryhttps://bit.ly/3pHuNmA",Unknown,Unknown,Unknown,Unknown,"#farmingfortnight, #fishyfriday",@riseholmecampus,"https://t.co/W6KVHqPZAG, https://t.co/0eZ7M2xSWd",phrase_2021
https://x.com/Fiona_SCQF/status/1455206076429778950,2021-11-01T16:12:19.000Z,".@helenanneyoung1@mrscullenlhsand Mr Reid from@FVCollege@LarbertHighdiscussing the#pathwaysthat the SCQF can offer delivering so much more than what you would expect NPA,sCity and Guilds@cityandguildsFabulous success#SCQFCounts",Unknown,Unknown,Unknown,Unknown,"#pathways, #SCQFCounts","@Fiona_SCQF, @helenanneyoung1, @mrscullenlhs, @FVCollege, @LarbertHigh, @cityandguilds",,phrase_2021
https://x.com/FujuPhoenix/status/1458094866827825182,2021-11-09T15:31:21.000Z,"I can’t access the full article and can’t read the full story. But suppose I want to leave 5th form and go to@heartnstatrustto complete my compulsory 7 years, will I not receive a school leaving certificate after completing my CSEC orCity and Guildsexams? @MOEYIJamaica",Unknown,Unknown,Unknown,Unknown,,"@FujuPhoenix, @heartnstatrust",,phrase_2021
https://x.com/MrWoodsman67/status/1453080964691906564,2021-10-26T19:27:53.000Z,"I have got mycity and guilds706/3 in advanced pastry but I’m always in ore of these amateur bakers#GBBO, I’m sure I would struggle at most things they do",Unknown,Unknown,Unknown,Unknown,#GBBO,@MrWoodsman67,,phrase_2021
https://x.com/NatalieOrigo/status/1425043828222877697,2021-08-10T10:38:19.000Z,City and Guildsdid survey - here is another linkhttps://cityandguildsgroup.com/research/generations-at-work-2017…#LifelongLearning,Unknown,Unknown,Unknown,Unknown,#LifelongLearning,@NatalieOrigo,https://t.co/eUnC30ad3U,phrase_2021
https://x.com/Bikeworksuk/status/1466452150133927944,2021-12-02T17:00:12.000Z,"This year 73 people qualified with aCity and GuildsLevel 2 in Cycle Mechanics through Bikeworks! 

And many have gone on to paid employment with help from our Employment & Skills Programme. 

For more info and to see dates for 2022 see the website here:https://bit.ly/3G9O9YM",Unknown,Unknown,Unknown,Unknown,,@Bikeworksuk,https://t.co/ZWqhwYb0sf,phrase_2021
https://x.com/GoodVetPetGuide/status/1441039660810215429,2021-09-23T14:00:03.000Z,".@KPS_Canterburyoffers Dog Grooming on a 1:1 Basis - no crates or cages Services include Wash and Fluff | Full Groom and Puppy groom treatments
Plus Teeth cleaning | nail trimming also availableCity and Guildsqualified | Salon in#Canterburyhttps://goodvetandpetguide.com/pet-services/kings-pet-services-dog-grooming-canterbury…",Unknown,Unknown,Unknown,Unknown,#Canterbury,"@GoodVetPetGuide, @KPS_Canterbury",https://t.co/Uz7rAYIBgt,phrase_2021
https://x.com/WestSuffolk/status/1462714777533362184,2021-11-22T09:29:13.000Z,"If you're a practicing electrician, you can boost your business by getting qualified to install Electric Vehicle Charging Equipment in public, private and commercial locations.

Sign up here for the@WSC_ElectricalCity and Guildscourse in January:https://wsc.ac.uk/courses/plumbing-and-electrical/207-level-3/9277-city-and-guilds-2919-01-level-3-award-in-electric-vehicle-charging-equipment-installation-21et574537…",Unknown,Unknown,Unknown,Unknown,,"@WestSuffolk, @WSC_Electrical",https://t.co/Szjca0zauY,phrase_2021
https://x.com/WestSuffolk/status/1470321378897403904,2021-12-13T09:15:08.000Z,"City and Guilds2919-01 Level 3 Electric Vehicle Charging Equipment Installation | 24 Jan | £325

Aims to provide expert guidance to practicing#electriciansto gain knowledge and understanding on Electric Vehicle charging equipment installation.

Sign up:https://wsc.ac.uk/ev-qual",Unknown,Unknown,Unknown,Unknown,#electricians,@WestSuffolk,https://t.co/k4khjdF8In,phrase_2021
https://x.com/Pauline_WAW/status/1404900451741470722,2021-06-15T20:35:44.000Z,There are currently 4 places available on the one day Understanding Suicide Intervention course on 13 Jul.  This is a level 4City and Guildsqualification. SLCs can be used. Further dates are also available on request.  No previous training is required.https://eventbrite.co.uk/e/understanding-suicide-interventions-mod-welcome-slc-funding-can-be-used-tickets-151554837599…,Unknown,Unknown,Unknown,Unknown,,"Pauline@WorkingAtWellbeing, @Pauline_WAW",https://t.co/CKPhwZbnpf,phrase_2021
https://x.com/MackenzieConstr/status/1415262075161620482,2021-07-14T10:49:07.000Z,"Recently, some of our team successfully completed theCity and Guilds: Level 3 Award in Education and Training Certification, the skills developed as part of this course will play a vital part in continuing development of our in-house Training Academy.https://mackenzieconstruction.com/foundations-for-the-future-strengthening-our-in-house-training-capabilities/…",Unknown,Unknown,Unknown,Unknown,,@MackenzieConstr,https://t.co/F8SfzIr9OW,phrase_2021
https://x.com/KhloeRuthie/status/1445758966454112262,2021-10-06T14:32:53.000Z,"Hello.
My name is Ruth Nyamizinga and I hold a diploma ofcity and guildsin Information and Communication Technology (ICT)

Tilembeniko ntchito",Unknown,Unknown,Unknown,Unknown,,@KhloeRuthie,,phrase_2021
https://x.com/Bikeworksuk/status/1452641105690996749,2021-10-25T14:20:03.000Z,"Today is the last chance to get a space on theCity and GuildsLevel 1 in cycle mechanics starting a week today at the Velodrome in Stratford! 

For more information and to book your space see the website:http://ow.ly/RBw550GxtQG",Unknown,Unknown,Unknown,Unknown,,@Bikeworksuk,https://t.co/OUBCJTjSWo,phrase_2021
https://x.com/LSTATraining/status/1438118163355508745,2021-09-15T12:31:03.000Z,ThisCity and Guildsaccredited Basic Lead Bossing and Welding course (certificated by the Lead Sheet Training Academy Ltd) is a perfect add on for slaters & tilers whether they are involved in new build or re-roofing and provide an excellent startinghttps://leadsheet.co.uk/lead-welding-and-bossing-training-still-going-strong-for-the-south-west-roofing-training-group-in-the-south-west/…,Unknown,Unknown,Unknown,Unknown,,@LSTATraining,https://t.co/CjNAQr60EL,phrase_2021
https://x.com/rattlecans/status/1423327196295352323,2021-08-05T16:57:02.000Z,"A PhD was never seen as training before.

Let's face it, PhDs are earned in institutions of learning, no theCity and Guildsof Master Cabinetmakers

Education<> training.",Unknown,Unknown,Unknown,Unknown,,@rattlecans,,phrase_2021
https://x.com/ASYADGroup/status/1467499745266524165,2021-12-05T14:22:58.000Z,"Enhancing customers experience and adopting the best international practices,@mwasalat_omreached new levels of excellence and recognition by obtaining the prestigiousCity and Guildsinternational accreditation

Read more:https://bit.ly/3DqSXHh#ASYADGroup",Unknown,Unknown,Unknown,Unknown,#ASYADGroup,"@ASYADGroup, @mwasalat_om",https://t.co/tOeYKaJNZ4,phrase_2021
https://x.com/WestSuffolk/status/1473235951954628608,2021-12-21T10:16:37.000Z,"We're running theCity and Guilds2919 Electric Vehicle Charging course in January. Charge up your new year with this electrifying qualification. New homes will need to have EV  charging points from 2022 so it's great for boosting your business!

Sign up:http://wsc.ac.uk/ev-qual",Unknown,Unknown,Unknown,Unknown,,@WestSuffolk,https://t.co/fSOTuXa5tV,phrase_2021
https://x.com/OutreachRescue/status/1436757031483027460,2021-09-11T18:22:24.000Z,"Another busy week here at Outreach, Engie have been on a FREC course run by ORMS, whilst Russ has been busy taking aCity and GuildsLevel 4 Managing Work in Confined Space. Below you'll find a group from London Ambulance Service getting to grips with Saf…https://lnkd.in/dTW8-maf",Unknown,Unknown,Unknown,Unknown,,@OutreachRescue,https://t.co/JWBZ8a7SIz,phrase_2021
https://x.com/Bikeworksuk/status/1450129665696403463,2021-10-18T16:00:29.000Z,"There are a few spaces left on our two Level 1City and GuildsCycle mechanic November courses! 

For information and to book your space see the website:https://bikeworks.org.uk/cityandguilds-level1/…",Unknown,Unknown,Unknown,Unknown,,@Bikeworksuk,https://t.co/Dyz2jWOBX1,phrase_2021
https://x.com/AsyadGroupOman/status/1467499745056858125,2021-12-05T14:22:58.000Z,"حصدت#مواصلاتشهادة الاعتماد الدولي من مؤسسة (City and Guilds) والذي يعكس الجهود المبذولة لتعزيز تجربة العملاء وتبني أفضل الممارسات العالمية في قطاع النقل العام ورفده بمخرجات وكفاءات وطنية قادرة على التعامل مع مختلف العمليات.
اقرأ المزيد:https://bit.ly/3ooGLCA#مجموعة_أسياد",Unknown,Unknown,Unknown,Unknown,"#مواصلات, #مجموعة_أسياد",@AsyadGroupOman,https://t.co/1UubSqwmrN,phrase_2021
https://x.com/AsyadGroupOman/status/1467499745841197070,2021-12-05T14:22:58.000Z,"Enhancing customers experience and adopting the best international practices,@mwasalat_omreached new levels of excellence and recognition by obtaining the prestigiousCity and Guildsinternational accreditation.

Read more:https://bit.ly/3lB7GJR#ASYADGroup",Unknown,Unknown,Unknown,Unknown,#ASYADGroup,"@AsyadGroupOman, @mwasalat_om",https://t.co/l6rkJqXHQf,phrase_2021
https://x.com/greater_jobs/status/1450733648878112775,2021-10-20T08:00:29.000Z,"Join@RochdaleCouncilas  a Technical Officer! 

Applications are welcomed from newly qualifiedCity and Guilds(or equivalent) who are keen to gain experience in the world of adaptions, or experienced qualified people who have great attention to detail.http://ow.ly/63Ls50GtGNx",Unknown,Unknown,Unknown,Unknown,,"@greater_jobs, @RochdaleCouncil",https://t.co/nUY18q2ndR,phrase_2021
https://x.com/adesdaily/status/1438529638561689601,2021-09-16T15:46:07.000Z,"I just converted an#antivaxxeron Facebook with...
""it Amazes me that so many young people are fine with Botox being injected into them by Debbie, who has aCity and Guildsin Beauty and a Fiat 500... But won't take a vaccine that protects everyone they meet forever"".....",Unknown,Unknown,Unknown,Unknown,#antivaxxer,@adesdaily,,phrase_2021
https://x.com/TheGoodDogGuide/status/1454451779819683845,2021-10-30T14:15:01.000Z,In The Dog House in#Swindon#WiltshireareCity and Guildsqualified and offer a fully insured#doggoomingservice.http://bit.ly/2z1wcKA,Unknown,Unknown,Unknown,Unknown,"#Swindon, #Wiltshire, #doggooming",@TheGoodDogGuide,https://t.co/JgkGJo1Tas,phrase_2021
