Tweet URL,Created At,Text,Tweet ID,Likes,Retweets,Replies,Hashtags,Mentions,URLs,tag
https://x.com/cityandguilds/status/1889007397013766546,2025-02-10T17:43:54.000Z,"It was inspiring to hear from the Rt Hon Baroness@Jacqui_Smith1,@andrewpakes_,@NeilDotObrien, and the Rt Hon Sir Lindsay Hoyle,@CommonsSpeaker, on the importance of apprenticeships and the achievements of the brilliant apprentices in the room.#NAW2025#SkillsForLife(3/3)",Unknown,Unknown,Unknown,Unknown,"#NAW2025, #SkillsForLife","@cityandguilds, @cityandguilds, @Jacqui_Smith1, @andrewpakes_, @NeilDotObrien, @CommonsSpeaker",,to_2025
https://x.com/cityandguilds/status/1889007393909956918,2025-02-10T17:43:53.000Z,"City & Guilds is proud to sponsor four of these awards, and it was fantastic to celebrate the national finalists today, as well as some of the outstanding apprenticeship provision across the sector.#NAW2025#SkillsForLife(2/3)",Unknown,Unknown,Unknown,Unknown,"#NAW2025, #SkillsForLife","@cityandguilds, @cityandguilds",,to_2025
https://x.com/EALAwards/status/1894780237608603652,2025-02-26T16:03:06.000Z,"@cityandguildsrun free webinars and events throughout the year to ensure customers are supported at every stage, from curriculum planning to ongoing delivery.Check out their upcoming events:https://bit.ly/3TIp00w#EAL",Unknown,Unknown,Unknown,Unknown,#EAL,"@EALAwards, @cityandguilds",https://t.co/nj6JNqBJ3s,to_2025
https://x.com/AngharadCandG/status/1897946312764506187,2025-03-07T09:43:57.000Z,@cityandguilds#NTFWConference2025,Unknown,Unknown,Unknown,Unknown,#NTFWConference2025,"@AngharadCandG, @cityandguilds",,to_2025
https://x.com/AngharadCandG/status/1904268004554060215,2025-03-24T20:24:06.000Z,@cityandguilds,Unknown,Unknown,Unknown,Unknown,,"@AngharadCandG, @cityandguilds",,to_2025
